employee_id,hotel_id,first_name,last_name,email,role,employment_status,hire_date,created_at,updated_at
1048,4,We_650d80,East_cfc963,campbellthomas@example.com,Provide age green make source spring social card.,Others move fall bar end wish full according step trade it.,2025-12-01,2025-05-30 03:04:29+00:00,2024-07-30 05:53:09+00:00
1049,11,Say_739ce9,Shoulder_1ac5ea,jason70@example.org,Within spend green surface try meet talk board weight baby nice test son.,May positive they who every town quite project.,2026-11-05,2025-06-16 02:48:20+00:00,2025-05-09 00:30:26+00:00
1050,2,Scientist_ef3cd4,Risk_3ca058,kevin44@example.net,Then window medical morning down ok gun sort community great really sound.,Himself interest talk cup Mrs box especially involve star.,2026-09-08,2025-02-13 10:39:51+00:00,2026-02-24 18:23:07+00:00
1051,10,Especially_bd5962,During_0dbf21,meganrodriguez@example.org,Usually condition and day artist expert item American.,Shake necessary away raise him gas hot.,2024-01-17,2024-10-29 18:03:22+00:00,2025-12-24 22:06:44+00:00
1052,8,Late_05e009,Foreign_6b018c,gwiley@example.net,Light sea find up account traditional after I he recognize.,Oil will test claim than test hold television defense ground media.,2024-06-06,2025-06-03 14:39:29+00:00,2025-05-05 13:41:44+00:00
1053,12,Almost_769449,Write_943be2,smorris@example.com,Stay many people us week no box cut admit crime protect next end.,Sea century respond safe discussion apply next.,2025-02-20,2025-11-28 19:50:25+00:00,2026-03-15 13:07:31+00:00
1054,3,Prove_b29a3d,Behind_03ca05,pcontreras@example.net,Maybe poor person bed save nearly success spring street resource decide.,Most executive watch enjoy former food cultural manager professional.,2024-02-11,2025-09-23 02:05:39+00:00,2024-03-27 19:29:27+00:00
1055,11,Occur_cc2fc9,Ground_05201c,dustin03@example.com,Candidate dream involve must say sign study choice get ago who.,Free course also federal radio meeting politics under different deal.,2026-02-13,2024-04-07 19:56:29+00:00,2025-10-18 23:41:02+00:00
1056,3,Several_b92d6b,Assume_39bb1a,jrogers@example.com,Economic front back college improve school husband take idea cause like.,Activity move green high building loss car.,2026-03-21,2025-04-05 08:56:46+00:00,2025-09-03 15:53:12+00:00
1057,2,Control_899b70,Red_9f3992,bennettnicholas@example.net,Cause power enter staff television read rest ability own.,Leader look property write establish choice.,2026-10-28,2024-03-14 14:25:23+00:00,2024-06-18 11:00:15+00:00
1058,5,Cost_8dfc04,Strong_4eaa4f,george83@example.org,Agency mind according should believe question chance.,Source somebody Congress article executive nature community paper inside brother himself list.,2026-09-20,2025-04-05 02:38:24+00:00,2025-05-15 16:45:13+00:00
1059,10,Capital_e1eb1c,Table_6ccf82,kaylee68@example.org,Open Republican property subject those lot.,Significant Mrs stuff should movie produce Republican pretty tough one five.,2025-12-16,2025-11-29 16:50:32+00:00,2025-11-17 22:29:47+00:00
1060,11,Front_233b52,Strategy_823335,vicki57@example.org,Then mention start speech likely throw six too word your good be.,Early value when perhaps foot discussion case support quickly.,2024-07-26,2024-06-15 16:13:29+00:00,2024-09-04 19:19:22+00:00
1061,11,Forward_d06115,Half_f98a70,amberevans@example.com,Well life choose himself there feeling win city.,Just on course four style good hospital.,2025-01-24,2025-08-03 19:08:13+00:00,2025-04-18 19:28:11+00:00
1062,10,Thing_714978,Artist_497332,gutierrezmonica@example.net,Any ready one body third kind weight morning his.,Deal stay red not base usually case heart truth add.,2026-10-17,2024-06-08 02:27:12+00:00,2025-11-08 20:47:38+00:00
1063,2,Friend_a5f204,Appear_2e1f53,michaelcarpenter@example.org,Yard exactly ten agent time responsibility value nature.,Process anything partner sing among rule.,2026-06-04,2024-06-03 18:25:29+00:00,2025-12-13 19:23:46+00:00
1064,1,Adult_c88680,Because_5e54b4,bhicks@example.com,Mission government authority Congress up animal ground benefit long trouble hope huge official.,Suffer relationship all season cover single suggest new personal able.,2024-11-08,2024-07-27 13:53:18+00:00,2024-11-21 02:45:14+00:00
1065,8,Choose_62aef0,Fund_f959fb,hilllisa@example.net,Wait call artist not appear me fight understand himself avoid.,Window up other again day measure listen what anyone whose look per enter.,2024-04-03,2025-11-12 09:46:39+00:00,2025-02-19 11:51:48+00:00
1066,10,Eye_4e4d47,Class_c64de6,alexanderrivera@example.org,Age seek professor person five instead and story smile.,Final time cost even hit stay energy and finish head.,2026-09-01,2024-11-14 19:15:17+00:00,2024-09-16 01:14:32+00:00
1067,6,Various_69e49c,Medical_44d19c,ryanpierce@example.org,Party their since others quickly create senior possible action.,View add year ten benefit push short only.,2026-12-10,2024-11-05 19:55:52+00:00,2025-03-18 09:47:39+00:00
1068,3,Test_45f2b1,Draw_44614a,sbaldwin@example.org,Hit enjoy onto task then small once however same Congress game food difficult.,Change before bed seem here system pay there travel game chair situation name.,2024-02-14,2025-01-20 22:35:31+00:00,2024-07-29 06:43:48+00:00
1069,10,Together_fdbc81,Public_49195c,zmason@example.org,Involve world could south performance eye my prove score unit bill film.,Player win various such grow power decision image morning whose similar sing cup.,2024-10-18,2024-09-27 07:21:56+00:00,2024-12-29 17:15:11+00:00
1070,10,Card_ae523e,Fine_1bef00,mpalmer@example.com,Happy population game hour continue success claim example show public.,Decision already author occur ahead fund staff shoulder meet start prevent data final.,2024-10-13,2024-05-29 09:24:47+00:00,2026-01-16 17:11:46+00:00
1071,12,Interview_5eae26,Education_32bc94,jonhernandez@example.org,Thousand seek forget image politics thought family.,Describe head pay someone population during claim ten.,2026-08-18,2025-09-28 10:06:31+00:00,2024-06-07 16:02:19+00:00
1072,4,Leg_8bd665,Lawyer_06b2be,fisherlaura@example.net,Consumer sound friend across car than voice listen plant well himself environmental indeed knowledge.,Still financial industry us while grow oil he purpose today.,2026-02-22,2025-03-02 22:57:47+00:00,2024-11-14 21:21:53+00:00
1073,8,In_f7e569,Of_a9c54f,christinayoung@example.net,Have since tough build quite personal build method produce each church thank nearly.,Store short national involve behind beautiful professional much story accept green away together.,2026-09-13,2024-05-30 19:03:14+00:00,2024-12-23 15:38:35+00:00
1074,8,Drive_e054c9,He_e82370,andreaperez@example.org,Student old onto serve similar every many mouth begin ask.,Major six training remain audience list eight view page police.,2025-07-29,2024-07-05 23:17:28+00:00,2025-05-13 05:32:00+00:00
1075,11,Bad_746adb,Energy_6fed0e,qhowell@example.net,Force another today reflect memory religious listen continue activity picture unit.,Build lawyer according couple woman stay language prove occur list sure.,2024-07-03,2025-03-04 20:55:23+00:00,2024-06-13 18:37:12+00:00
1076,8,Citizen_ad1f85,Practice_70e72b,chaneyemily@example.org,Near we treat on hospital mother especially today school.,Mission summer adult mean edge fish bank town friend.,2024-07-06,2025-04-09 17:42:05+00:00,2024-11-16 03:44:59+00:00
1077,6,Then_70be39,History_103b14,wpadilla@example.com,Which people need statement sort recognize.,Choice catch half very future animal threat suggest show general work he certain.,2025-10-17,2024-05-21 04:54:10+00:00,2024-02-25 04:21:40+00:00
1078,10,Individual_1392e0,Process_3e49af,derek28@example.com,Picture figure husband more success send.,Structure strong although address American late detail country message.,2024-05-26,2024-09-20 03:43:44+00:00,2024-10-13 02:29:13+00:00
1079,8,Hotel_b346ae,Sit_b795b8,hudsonnicole@example.com,Arm stage purpose region him hard prevent.,Foreign standard city trip factor might from article.,2025-08-25,2025-07-11 11:39:49+00:00,2025-03-24 12:04:57+00:00
1080,8,Girl_12b696,Growth_24ae71,mannbenjamin@example.org,Degree wrong bit course work go cup trial ask they left perform language.,Account other help share result doctor floor risk above share affect political.,2026-01-17,2024-04-18 11:18:05+00:00,2025-06-06 07:34:06+00:00
1081,10,Door_6c6ea5,Evidence_71361a,vallen@example.org,Miss provide rate a difficult improve difficult then maintain tax always interview.,Represent in a moment determine include organization game color tax knowledge.,2026-09-19,2024-10-19 04:00:12+00:00,2024-05-13 15:39:24+00:00
1082,3,Scientist_d80f59,Much_a5b78f,justintucker@example.com,Likely window watch task book fear film should.,Piece camera natural alone not image from red land fill protect be term.,2026-05-26,2024-09-01 20:27:16+00:00,2025-10-30 02:41:11+00:00
1083,4,Use_064b0f,Focus_639201,brianna75@example.org,Smile production cup trouble return account task idea administration likely same.,Cost whose risk life your stock.,2026-02-11,2024-01-29 08:11:20+00:00,2026-04-24 20:11:37+00:00
1084,9,Must_77b1b0,Actually_db461f,garycollins@example.org,South development may try recognize red shoulder note democratic better maintain.,Bit understand seem would country perform operation whether house old six issue.,2024-09-03,2025-03-12 02:20:46+00:00,2025-12-17 11:40:47+00:00
1085,3,They_d4ede6,Ago_680dc8,estradajessica@example.com,Simple first expect consumer consumer bank list network also sometimes collection wind name manager.,Share he room until artist bank wonder executive present compare practice.,2026-02-25,2024-11-14 02:07:16+00:00,2025-01-03 12:04:42+00:00
1086,3,When_4e2209,Then_3fc5f7,raymond37@example.com,Here they season drug parent future should blue information full left stuff.,Film onto building so song one stay hot development range.,2025-09-13,2025-06-12 22:58:11+00:00,2025-09-22 13:08:04+00:00
1087,3,Rate_0bac77,Wrong_c0d9c4,crichardson@example.com,Accept necessary live attack century us still later year.,Nearly international author network doctor need worker author increase site clear anyone business.,2025-06-14,2024-02-19 01:05:51+00:00,2026-01-02 10:46:43+00:00
1088,12,Growth_4569ee,Congress_da0ac6,walterford@example.com,Vote today ground role team hold science art.,Stock fill tonight possible reflect hot arm nearly young raise.,2026-02-01,2024-12-08 16:07:43+00:00,2024-12-01 13:49:13+00:00
1089,12,Forward_ebd268,Probably_fe8411,tasha50@example.com,Himself realize chair message door may.,Shoulder technology gas expect bag others here collection least.,2025-04-07,2025-11-10 03:04:40+00:00,2024-03-18 07:13:40+00:00
1090,4,Half_714b34,Father_cc5d25,kevans@example.com,Series yard mean ten thing address about head.,Section environmental speech standard hit strategy purpose account field.,2025-07-12,2025-02-15 09:21:11+00:00,2025-06-07 23:02:40+00:00
1091,9,Return_b1bd54,Form_29a6b1,cheyennepatton@example.net,Car at sister similar ever political state fish left.,Despite likely record employee single glass contain.,2025-11-30,2025-02-22 14:55:47+00:00,2026-02-14 02:22:26+00:00
1092,5,Baby_d14627,Their_ce6465,mreed@example.net,Off seat the suffer near lead case charge his bank.,Off none future much long particularly true more pay.,2024-10-03,2024-03-28 16:56:05+00:00,2024-06-24 20:00:42+00:00
1093,10,Piece_373356,Blue_03bd36,ryan76@example.org,Adult determine whether make cold while blood if pass low condition believe.,Ago whether offer finally company vote.,2024-09-26,2024-11-16 19:22:17+00:00,2024-11-22 15:00:28+00:00
1094,6,Three_cd290e,Maybe_813843,kathrynromero@example.org,Six fish new trip write test clearly sometimes term do election much training.,Staff character full believe scientist across stuff newspaper stand color beyond customer.,2025-02-17,2024-02-18 05:40:44+00:00,2026-01-12 03:34:04+00:00
1095,2,Travel_2e73c2,Deep_fa9088,collinsmichelle@example.net,Effect along year modern wear authority economy according grow for run half.,Discussion paper camera discuss into southern picture adult relationship if interesting story.,2026-06-27,2025-08-05 11:17:55+00:00,2025-12-26 04:39:30+00:00
1096,6,Poor_001e04,Subject_0a4d77,qsellers@example.org,Drop poor court home computer no despite manage information sister establish hundred design.,Pass actually able fill you entire ago way decide fear industry author.,2024-12-22,2024-10-24 12:15:12+00:00,2024-07-30 23:54:01+00:00
1097,5,Either_8fb4e8,Soon_a64cbd,melissawood@example.com,Tonight fast goal Democrat wall rise lay son.,Actually include manager hair particular responsibility.,2026-10-22,2025-05-06 19:28:16+00:00,2024-08-21 03:17:36+00:00
1098,7,Other_6f4d04,Including_275fbd,matthewthompson@example.com,Loss car piece also Mrs before provide successful serious determine happen low argue claim.,Court section short want strategy chance well two.,2025-02-06,2025-10-03 08:11:15+00:00,2025-06-13 20:43:10+00:00
1099,12,Check_c92c92,Central_de897d,steeledeborah@example.com,Kind its lay scientist get not white together.,Space indeed walk decision could activity final cover full old notice.,2026-10-21,2024-07-10 20:48:50+00:00,2026-02-02 16:12:22+00:00
1100,1,Religious_955826,Not_0c3465,carlburns@example.com,What sense major away toward he officer.,Situation card from be read attack bill huge would heavy.,2025-03-02,2024-04-22 14:37:17+00:00,2024-05-17 17:31:12+00:00
1101,3,Become_c578f1,Candidate_2701f7,rmiller@example.com,History difference improve piece this market than interesting seven.,Machine offer moment foreign education marriage question.,2026-05-10,2025-05-07 22:44:18+00:00,2025-09-27 07:31:36+00:00
1102,4,Official_d24935,Tonight_00d5c5,rallen@example.com,Until ask focus allow Republican student either trade ever rest road.,Position cause material turn suggest employee.,2025-07-03,2024-09-08 09:19:44+00:00,2025-12-07 03:14:29+00:00
1103,10,Music_0cbf7d,Easy_b4eb6d,robinsonpaul@example.com,In step movie investment example draw happen voice.,Activity Mr strategy time plan quality drop certain him.,2025-05-07,2025-05-05 16:43:57+00:00,2025-03-07 12:29:42+00:00
1104,1,Magazine_c4b380,Far_1ccd47,monroeangela@example.org,Sometimes almost hand discuss table stage stay their ground.,Billion level thing worry night return.,2026-10-24,2026-01-04 16:55:02+00:00,2024-09-22 02:24:01+00:00
1105,10,Former_7f197d,Remain_5843b9,jenniferlarsen@example.net,Home attack despite special bank indeed particular officer affect ok keep.,Forget offer particularly that discuss cell doctor ever a majority strong there art.,2024-11-02,2025-05-02 20:52:00+00:00,2025-06-17 12:06:45+00:00
1106,1,Person_3fc9fe,Economy_ac5638,ginaschroeder@example.com,Future particular color water partner tough activity few fill his top important new.,Discuss treat lawyer worker and wait special particular eye baby push office vote.,2025-06-16,2024-02-29 12:15:15+00:00,2024-10-31 16:39:56+00:00
1107,9,Beat_de3608,Play_0566af,qfranklin@example.net,Miss machine artist decision particular worry reveal clearly sort against card theory.,Leg fish usually front remember opportunity continue through positive.,2026-02-16,2024-08-09 23:12:39+00:00,2026-02-09 16:14:07+00:00
1108,7,Exactly_0e49e8,Memory_d7961c,david42@example.com,Sport several step experience base culture need man approach know issue next top.,Southern oil popular need trip public control want time seat.,2026-05-24,2025-08-19 09:51:54+00:00,2024-10-05 16:01:07+00:00
1109,8,Not_ec8823,Look_7fb9f6,andrewfigueroa@example.net,Business risk race standard theory win evidence conference machine much million.,Difficult PM social interest benefit television my director behind long.,2026-11-28,2025-03-22 06:31:36+00:00,2024-04-29 11:42:50+00:00
1110,1,World_d0a28c,Choose_4eea34,bestbrian@example.org,Ready any take what discussion film democratic also community wide represent heavy.,School thank visit size campaign simply vote.,2025-03-13,2024-12-13 10:09:07+00:00,2025-12-17 23:22:04+00:00
1111,5,If_ecf0a7,List_e7d8d8,amberchandler@example.com,Firm already trade whole yes radio high dark property difference become data pressure.,Language offer subject tough authority property miss manager magazine.,2026-11-07,2026-01-06 01:30:08+00:00,2025-04-28 09:15:57+00:00
1112,4,Argue_4527f7,Who_4ea36d,scottstephen@example.com,Subject time indicate but never water commercial offer and his news show general.,Program type consider age tough however a next better focus alone to.,2026-03-26,2024-06-01 08:59:53+00:00,2024-05-24 12:45:31+00:00
1113,8,Hospital_e255b4,Accept_1cdc14,riceveronica@example.net,List exist pay member modern position fire news take rich poor game.,Life PM must reveal give threat wonder.,2024-08-20,2024-05-15 21:40:52+00:00,2025-06-27 12:37:39+00:00
1114,3,Or_d497a5,Vote_9a54d7,allenaustin@example.net,Specific hope wall administration step rule push short perhaps thought success media.,Green church box game yet vote statement.,2025-04-21,2024-09-08 14:53:55+00:00,2025-01-31 09:45:02+00:00
1115,9,Subject_57d07c,Reason_ae19ab,pbush@example.com,Out sign play him home old story.,Hospital consumer expert something management seven page data pretty red.,2026-10-13,2025-04-17 09:54:14+00:00,2024-07-20 11:21:48+00:00
1116,9,Boy_b0aa0e,List_acd92d,jsims@example.com,Last apply authority respond mouth kind security later.,Drive fly yes upon station discover since detail PM those billion economic current.,2025-09-03,2024-04-07 07:31:30+00:00,2024-07-12 18:38:45+00:00
1117,6,Structure_927451,Color_fe22c6,martinmolly@example.org,Vote management he forward in be long prepare.,Hit respond structure eat glass also raise none those.,2025-11-09,2025-10-24 03:10:28+00:00,2025-11-04 11:34:09+00:00
1118,9,Next_8b1e10,Your_5eb91e,zsummers@example.com,Up watch draw war week especially among.,Decision big consumer feel again baby kid.,2026-02-15,2024-10-20 12:20:00+00:00,2026-05-29 01:48:53+00:00
1119,7,Enough_082e5b,Reason_c4e908,jeffrey95@example.net,Do whole director economic recently organization recently.,Attorney financial college husband person power evening sometimes feeling big.,2025-11-21,2025-02-16 19:26:12+00:00,2026-03-09 04:54:40+00:00
1120,3,Build_aa8113,Must_a7f696,nicholsjames@example.net,Film wife room stand growth customer break.,Home seven put marriage cause reason miss season show have baby offer break.,2026-07-28,2024-12-15 10:02:44+00:00,2025-10-11 15:41:39+00:00
1121,8,Miss_df978e,Affect_0d6143,catherine87@example.org,Toward member wide power wonder brother public Democrat.,Role role audience or market scene magazine southern several send thus number understand.,2026-06-05,2025-02-19 16:48:18+00:00,2025-11-24 18:30:49+00:00
1122,8,Office_f89548,Minute_3ce624,pearsonnoah@example.com,Election new girl position meet reduce skin once day region.,Oil floor yourself staff goal program win service energy run.,2026-06-10,2025-09-02 06:05:52+00:00,2026-01-20 16:23:08+00:00
1123,2,Realize_9ed189,Sure_1cfd2a,stephanieward@example.org,Technology fire watch no knowledge despite car page lot prove every eye care.,Return must produce early red however coach begin.,2026-04-17,2025-04-10 14:36:42+00:00,2025-05-01 14:52:05+00:00
1124,7,Usually_56325c,Line_3d1134,cgentry@example.com,Along yeah memory bar as there Republican.,Fire network structure other trade why unit event help pass mother place research.,2025-12-01,2024-08-22 17:13:15+00:00,2024-04-19 23:31:29+00:00
1125,9,Event_3fb096,Game_dcfe06,randall74@example.org,Want food factor nice all research yeah series player research.,You real summer feeling beyond Republican city at sure across begin.,2026-11-05,2025-10-02 01:13:25+00:00,2024-10-18 07:47:49+00:00
1126,2,Environmental_69e38e,Month_5a3c54,bryan@example.net,Even address minute machine miss involve.,Direction theory rule question present since later start assume statement.,2025-03-11,2024-09-13 16:30:31+00:00,2025-01-15 08:19:42+00:00
1127,1,Address_d287aa,Door_2202d3,smithjoseph@example.org,Despite trade page fight talk question.,Live whole animal project national across boy institution some radio candidate miss.,2025-01-21,2025-01-01 14:16:55+00:00,2025-12-26 17:40:13+00:00
1128,9,Art_110cb8,Usually_f0a02d,jensenlinda@example.com,Woman open politics where movie surface seat trouble.,Network become nor fear available sense.,2026-04-21,2024-09-06 01:34:00+00:00,2025-08-23 11:17:34+00:00
1129,12,Nothing_2842ef,Pressure_f9fda8,larry24@example.org,Return arm pick item later firm.,Shoulder unit cause appear group glass enter final ten with them a.,2024-07-21,2024-07-18 09:05:55+00:00,2024-08-30 04:45:06+00:00
1130,7,Reach_eed8ae,Fly_86d33e,tateaustin@example.com,Than rate why sound game social sense agency after.,Outside kid inside instead participant interesting.,2024-04-24,2025-09-30 13:58:43+00:00,2026-02-27 06:00:37+00:00
1131,10,Politics_f4fb65,Smile_2f0799,john08@example.org,Today artist model avoid interest probably itself trouble rest partner occur guy tonight.,Most measure agent get purpose house argue.,2025-11-01,2025-08-27 08:11:44+00:00,2024-06-21 08:28:03+00:00
1132,7,Carry_850712,Cost_2b55c4,whiteashley@example.com,Low article care respond face rather think air history meeting fast.,Billion color during almost wind program already join who bed game clearly.,2024-02-15,2025-10-17 09:21:33+00:00,2024-10-30 20:17:58+00:00
1133,11,Send_df8105,Recognize_fed025,eguerra@example.org,Southern later avoid how suffer should fish hot community me.,Tree claim dream fly level hot onto.,2025-05-30,2024-03-18 13:55:30+00:00,2024-12-21 21:42:23+00:00
1134,9,Sort_d102cd,Whom_91433b,ymiller@example.net,Soon it example cover arrive none.,Section fund couple black difficult manage step nor production option.,2026-02-08,2024-06-30 03:09:58+00:00,2025-08-14 20:25:09+00:00
1135,2,Whatever_a27100,So_a82105,wboone@example.org,President too chance tree outside young.,Organization authority anything table fly necessary represent establish control such.,2026-04-05,2024-05-15 00:53:11+00:00,2024-04-19 23:03:53+00:00
1136,11,Democrat_6b09a7,Base_109fd9,kristin16@example.net,Physical him data simple employee particularly language himself.,Idea score close media them sound strategy such affect even sport security.,2026-01-25,2024-12-01 16:54:04+00:00,2024-04-21 19:34:18+00:00
1137,9,Ground_7fee92,Heavy_336f11,tanyamartinez@example.org,Somebody crime relationship performance pay entire.,Concern may west wide decision government half together Congress economic.,2025-02-14,2025-05-26 04:36:23+00:00,2024-04-20 02:26:30+00:00
1138,10,Air_3bfaba,Old_78d13c,ashleybennett@example.net,Special manage reflect whose economic my.,Serious newspaper benefit certain west force garden wish cold include.,2025-08-05,2024-12-29 10:54:55+00:00,2025-10-22 20:48:40+00:00
1139,8,Paper_41f27e,Practice_1babcb,margaret71@example.net,Significant begin new cause wide best subject.,Quality same act music it energy me bank nice bag guess cover.,2026-10-23,2024-09-10 18:03:52+00:00,2024-12-16 13:35:35+00:00
1140,12,Language_20a66c,New_88d191,egates@example.com,Either magazine office act soon set side born we.,Oil here century almost interest and school foreign same.,2026-02-13,2025-02-04 19:13:13+00:00,2025-01-16 06:56:22+00:00
1141,9,Have_269153,Themselves_677030,gonzalezamanda@example.org,Feel suddenly Congress charge story popular look table budget candidate dark she.,Nor explain quality military sound year policy PM building.,2024-08-09,2024-11-05 13:22:43+00:00,2025-06-16 13:05:38+00:00
1142,12,Manage_4bf18d,Town_5240d8,farmstrong@example.org,Song enough in camera sort Republican structure.,Them student where when statement exist where care clear crime.,2024-04-01,2025-02-13 18:38:16+00:00,2024-07-20 13:30:49+00:00
1143,12,Cultural_65ae45,Offer_632335,liujoshua@example.com,Stand former mouth situation popular special nothing PM sure bad begin energy close.,Card many than energy war smile through.,2025-08-11,2024-01-28 05:51:22+00:00,2024-12-24 01:19:22+00:00
1144,8,Charge_81b2e6,We_2e7d2f,charles62@example.org,Sometimes eat first everything yet low ready enough firm part.,Nice machine oil relationship response support affect.,2024-03-02,2025-12-31 08:09:03+00:00,2026-02-08 23:49:50+00:00
1145,10,Hit_7a296a,Impact_ec0d63,hubermichael@example.org,Care these down begin behind else adult decision none remember thank board radio.,Loss through wife yet throughout those green explain day.,2024-03-13,2024-12-24 08:49:44+00:00,2025-07-30 07:56:34+00:00
1146,9,Sing_05e613,Through_18a5a9,kdiaz@example.net,Stand arrive feeling quality why should section international.,Relationship other live develop create number when star.,2024-10-25,2024-10-06 15:13:07+00:00,2025-10-01 20:02:27+00:00
1147,2,Collection_56f477,Space_05aaa8,martinlaura@example.com,Series yeah certain specific court yard herself participant fly trip number executive case.,Only force sound range score theory drug information near try shake theory certain.,2025-03-25,2025-01-21 00:20:24+00:00,2026-02-13 12:48:06+00:00
1148,11,We_95252d,Picture_2469bd,michaeldavis@example.net,Perform lot base just call employee series knowledge effort skin.,Current which these within hair increase defense.,2026-04-04,2025-04-12 22:26:59+00:00,2026-05-29 04:28:48+00:00
1149,1,Current_04062f,Even_d684d8,christopher40@example.com,Cut hope a degree PM staff until ready traditional as now scene.,A fight outside behavior man another.,2024-07-21,2025-09-03 13:43:45+00:00,2024-09-17 08:53:13+00:00
1150,10,Recognize_7a27e2,Concern_96d049,kayleedavis@example.com,Approach writer however firm particularly walk market professor quality.,Seem after herself wait recognize serious relate.,2025-10-10,2025-09-09 16:12:34+00:00,2025-03-15 21:06:04+00:00
1151,4,Deal_064d5d,Like_8af3aa,rileysmith@example.com,Floor total sell education information you fire interesting effect study final.,National argue seven market budget fish professor.,2026-11-08,2025-09-23 04:07:46+00:00,2025-06-20 09:42:30+00:00
