employee_id,hotel_id,first_name,last_name,email,role,employment_status,hire_date,created_at,updated_at
525,5,Husband_ceaea8,Treatment_0d0821,stephanie77@example.org,While enter store small including half who care story.,Chair war bank former force among.,2024-11-14,2024-07-01 03:26:50+00:00,2025-11-05 21:16:11+00:00
526,6,Course_b4e9ea,Student_18bd07,mary17@example.org,Time resource night everybody social boy whose arrive song cut role buy.,Serious learn political seat government minute step term cultural community option apply health organization.,2024-05-22,2024-05-18 14:37:02+00:00,2025-11-14 18:01:52+00:00
527,7,Without_406948,Truth_c1b17a,john37@example.com,Art in purpose program sea water month quickly space sometimes of sport.,Movie citizen change ten clearly purpose.,2025-08-23,2025-01-16 05:50:16+00:00,2025-07-08 19:52:30+00:00
528,3,Message_d43bdd,Really_0966cf,courtney09@example.net,Voice save thus exist college common even though throughout nearly.,Beat woman decision just remain smile turn church second make.,2026-12-22,2024-04-04 17:06:59+00:00,2025-08-26 22:00:09+00:00
529,12,Practice_13552c,Run_6d875c,browningmary@example.org,Star for course character budget main him majority realize fund land doctor sea.,Face home perhaps air population turn story environmental allow simply international.,2026-04-16,2024-03-13 09:13:56+00:00,2026-04-30 21:15:07+00:00
530,6,Board_607764,Upon_c8ed4d,mollypalmer@example.org,Someone reason evidence respond seem any among either system hard economic space.,Military girl letter design class standard.,2024-12-26,2024-09-22 10:44:35+00:00,2025-04-22 01:47:25+00:00
531,8,Thus_8c059a,Employee_343afc,zarmstrong@example.org,Late dream air her about answer already generation.,On senior smile even wide sort base.,2026-10-18,2024-09-22 03:57:22+00:00,2024-10-30 07:08:21+00:00
532,11,Either_9c0be6,Large_28a7c6,john74@example.com,Ask current only thus decision north success fine.,Instead weight not clearly baby subject support find.,2025-11-09,2024-01-13 00:13:21+00:00,2024-04-22 03:23:55+00:00
533,2,Summer_6ad19f,Record_f8fc9b,amason@example.org,Decade citizen finally benefit first reveal open feel increase ground notice economy task.,Those candidate structure occur environment kind until line factor region office build.,2026-08-02,2024-04-28 04:05:54+00:00,2024-06-21 06:49:40+00:00
534,6,Game_f5d543,Pressure_8da5c8,johndecker@example.com,Attention avoid though would back meeting.,Time traditional apply young daughter nearly he nothing.,2025-05-19,2025-09-04 23:19:24+00:00,2024-04-19 00:54:02+00:00
535,10,Style_4f19aa,Financial_665174,anne77@example.com,Range third prevent pull card recent finally true support here time return this.,Various give positive senior measure specific threat.,2026-09-08,2025-07-02 12:01:48+00:00,2024-06-17 22:44:07+00:00
536,1,Prove_57084f,Will_e5a798,lawrence79@example.net,Investment usually argue six much radio law your.,Admit appear between dream first better go try memory field degree fact teacher.,2025-11-23,2024-04-29 09:02:06+00:00,2025-11-18 21:32:08+00:00
537,12,Piece_573ed8,Matter_55f2b8,carolmcdaniel@example.org,Discover lead different more source quickly author.,Head would effort when control edge know easy approach that reach raise job.,2024-12-10,2024-05-27 21:06:35+00:00,2025-06-18 16:04:45+00:00
538,10,If_e25741,Woman_9827e3,lperry@example.net,Manager budget program among respond grow must ask happy western page.,Add result foot may serious when particularly former allow official our resource.,2025-09-13,2024-02-15 15:16:13+00:00,2025-07-05 05:44:58+00:00
539,2,Shake_ca3199,Effort_6e1790,kennedydorothy@example.com,While quickly away his particularly night message experience she lawyer ago.,Drive study performance toward account join dark purpose myself provide police determine child.,2025-05-13,2024-03-31 19:01:28+00:00,2024-08-03 18:35:24+00:00
540,6,Mrs_dc70d0,International_568730,jenniferbarrett@example.net,New between rock way fall bed face only couple buy front subject.,Skill already land career hair speech success risk direction say beautiful or just.,2025-09-23,2025-09-25 10:39:37+00:00,2025-09-21 20:17:15+00:00
541,11,Safe_2c7350,Effect_ce061c,burnseric@example.net,Begin bad once measure cell design head none successful tough real.,Until economic attention there collection spring coach entire never such its himself.,2024-10-28,2024-02-05 07:05:25+00:00,2025-12-18 15:13:14+00:00
542,6,Over_9c50ff,Join_0f97a8,charris@example.org,Body here good still know name interesting tough organization occur minute provide.,Authority how population prepare system ready.,2025-04-30,2024-11-29 15:07:44+00:00,2026-02-28 18:08:08+00:00
543,11,Tax_db0ee6,Parent_43acce,simonsonia@example.net,Friend senior point article degree personal claim capital development message.,Consumer baby movement light international former college ready herself.,2026-05-01,2024-05-03 15:39:05+00:00,2024-09-29 21:27:32+00:00
544,7,Need_3899a4,Star_9b38bb,waltersmegan@example.org,Street improve father example international thank.,Since half long politics participant floor account owner possible fall.,2024-04-09,2024-11-13 02:45:19+00:00,2024-11-20 10:04:40+00:00
545,1,Firm_b1e49e,Population_f131a9,chubbard@example.org,Song role however very care college once stand him base alone way.,Over thank that than trial decade once knowledge win range.,2026-01-08,2024-06-27 12:40:45+00:00,2025-02-15 21:29:30+00:00
546,3,Station_ad8eb7,Writer_1f779a,castillowendy@example.net,Skin box happen plant station everybody north.,Establish young theory next boy friend beautiful central ability.,2024-11-06,2025-02-24 22:12:22+00:00,2024-04-02 05:46:27+00:00
547,8,Generation_405785,Life_0b0f83,alexanderford@example.com,Human imagine business evidence raise professional Mrs challenge theory fill have whole song alone.,Use social may mother number rich.,2024-07-15,2024-05-23 08:48:08+00:00,2025-07-07 19:21:21+00:00
548,2,Necessary_3c055a,Source_17a3ed,brandon80@example.net,Challenge room nice gun respond those south minute network those capital security choose win.,Especially nice suffer everyone whatever executive sing again local so career.,2026-04-04,2024-06-20 19:15:17+00:00,2025-04-25 04:28:41+00:00
549,6,Edge_377ea1,Safe_ecac4b,sarahjohnson@example.org,Name positive enough result seven painting partner explain specific her court on.,Page military control perhaps style new blue what around scientist ever.,2025-12-19,2024-07-27 09:24:20+00:00,2025-09-13 21:09:17+00:00
550,7,Artist_576fa0,Staff_e22f06,cherylnichols@example.com,Color paper each security employee production deep person style fight.,Sort throw simple ten one order control represent raise would hospital manage.,2024-06-01,2024-09-12 11:26:10+00:00,2025-03-06 17:40:57+00:00
551,8,Throughout_a13551,Game_a99f67,sweaver@example.org,Throw protect can would anything school stand national enjoy police clearly.,His short song reach move you.,2024-02-15,2024-09-05 02:55:08+00:00,2025-06-11 13:16:19+00:00
552,5,List_b2ec74,Oil_6e631f,vargasjamie@example.net,Risk detail focus water something direction.,Oil wrong either here cause here under body already.,2026-10-12,2024-10-05 12:45:52+00:00,2026-03-18 05:02:49+00:00
553,8,Explain_b644a9,Say_6e464c,raymonddavis@example.org,Into center ball here color produce speak theory such way.,Outside send record between mother whole be.,2026-07-17,2025-03-07 00:27:31+00:00,2025-03-08 11:54:14+00:00
554,5,Should_d17964,Law_ef1980,gwong@example.org,There style care list help think difficult seem catch PM.,From risk it week need example class tend claim record.,2025-03-05,2025-10-04 19:44:07+00:00,2024-07-21 20:56:54+00:00
555,4,Information_97de46,Sort_edf72b,juliaking@example.net,Baby probably box detail listen agency ever tend represent truth.,Time president stock have away direction difficult allow recent ability side energy single.,2026-03-04,2025-06-29 15:59:05+00:00,2025-01-31 04:40:25+00:00
556,8,Article_986949,Road_6e4206,emilymoore@example.com,Conference Mrs month light put dream dream more shake.,Catch most sport cover coach impact law have without receive.,2025-03-22,2024-06-22 10:54:20+00:00,2025-12-11 08:31:45+00:00
557,4,Window_5b55a9,Now_da2934,ysmith@example.net,Population hour lead data safe indicate home discover small.,Education into she up action per into interesting chance member six.,2026-11-06,2025-02-14 20:43:01+00:00,2025-10-14 23:15:28+00:00
558,4,Enough_35b6fb,Wait_729d3d,bonnie21@example.com,Expect medical poor center full bank garden rule former development.,Subject dog within field argue total election if minute to.,2024-06-21,2025-03-12 03:42:56+00:00,2024-11-14 13:16:53+00:00
559,8,Health_221cd3,Break_17dc36,zbailey@example.org,Institution alone here card hold bank another according meet quite hospital.,Ground age southern science radio development her million identify ever player into why.,2024-01-18,2025-09-08 03:37:36+00:00,2025-12-14 02:15:59+00:00
560,11,Effort_e01ea0,Country_fecca5,francisrobert@example.com,Analysis keep low summer material cup hit Congress part every important believe.,Audience head radio policy ability television else particular add identify.,2024-10-31,2025-04-18 02:06:51+00:00,2024-06-13 13:40:59+00:00
561,1,Likely_64ac33,Can_415cfb,wellsjustin@example.net,Item central reflect relate news appear drop.,Think rich piece remain wind key easy.,2026-06-18,2024-08-24 11:25:50+00:00,2025-07-29 20:39:13+00:00
562,5,Per_b4335c,Close_5fa5fe,speterson@example.com,Itself even culture close again just this answer treat better must.,Tough officer under ten military identify at tax series baby.,2025-10-04,2024-07-25 14:58:29+00:00,2024-09-09 14:02:14+00:00
563,9,Poor_c59f91,Family_3279b0,heatherskinner@example.com,Born identify trip color various sort society activity.,Help around provide space year good environmental leader who appear be anything.,2024-02-16,2025-11-26 12:04:54+00:00,2024-09-30 12:43:45+00:00
564,5,State_a82293,Month_6302b5,bcook@example.org,Also simply detail include now decide.,Skill can child little plan treat say threat some attention message send start.,2025-04-22,2024-01-13 07:18:10+00:00,2025-10-06 00:11:17+00:00
565,1,Town_dd9b00,Miss_770ba9,gpowell@example.com,Key life near huge process beat sort small type each.,Soon order approach quite this direction owner attorney career risk message all.,2024-08-02,2024-08-15 05:53:16+00:00,2025-02-27 14:30:05+00:00
566,12,Last_06d0e2,Baby_4fea25,etownsend@example.com,Out take training might admit sister truth oil hour serious cup property own get.,Change or cost little fish purpose owner.,2025-08-17,2024-09-06 16:19:38+00:00,2024-08-03 10:49:02+00:00
567,3,Race_56b26b,Surface_059116,todd13@example.net,Resource news be player less direction.,Baby interview analysis traditional condition poor teacher top wear suddenly.,2027-01-09,2024-06-20 06:19:49+00:00,2024-12-16 23:46:27+00:00
568,12,Open_078eb9,Stay_3ce412,connerjenna@example.com,Trip discussion most have little beautiful often south sister method herself card image.,Education these stuff call agree financial.,2024-07-08,2024-04-16 01:59:30+00:00,2025-02-06 14:32:08+00:00
569,7,Issue_0b7825,Political_8da85b,davisapril@example.com,Share police choose maybe order question cell that style cut all top weight.,Arrive lawyer daughter whatever school side care foot trouble network head meet.,2024-06-25,2025-01-28 05:43:47+00:00,2026-02-23 16:52:17+00:00
570,7,Without_7fdd5b,Continue_1ddf92,timothyfowler@example.org,Clearly adult red clear personal smile industry remember coach art choose.,Or late relationship interesting population response.,2025-10-21,2025-03-06 06:43:11+00:00,2025-01-01 05:49:25+00:00
571,8,Assume_db1311,Reflect_ee56b5,nwatts@example.org,Draw not hand safe character commercial political resource.,Home notice hot free job avoid imagine other whole election dark.,2024-11-04,2024-02-04 08:46:17+00:00,2026-02-22 10:10:33+00:00
572,10,Arm_5b820b,Add_6d1d72,fdelgado@example.com,Minute agreement mission value government social art sound hair find sure carry.,By watch follow mind couple through watch think old as.,2025-08-21,2025-01-27 07:30:37+00:00,2025-08-20 05:45:08+00:00
573,5,Tend_abfa4e,North_16f7b4,ramirezchristopher@example.org,Stage possible agency learn family about actually read.,Skin long sister night late lead trouble material fall ball.,2026-09-03,2024-06-29 08:26:31+00:00,2025-05-05 07:28:47+00:00
574,10,Image_1fae6b,Recognize_d213c8,egriffith@example.org,Later discover month would help purpose term figure list agree issue.,Prepare local big thank paper itself investment rich.,2024-08-03,2025-02-28 11:09:28+00:00,2025-10-06 03:58:45+00:00
575,3,Century_d3d50b,Quickly_8168f0,sean16@example.com,Performance technology wrong history itself model speech.,Program believe series wide trouble government Mr.,2025-08-31,2024-07-26 06:49:59+00:00,2024-12-15 14:44:00+00:00
576,11,Trouble_c1197c,Soon_b1524d,omartin@example.com,Figure last available drop against threat identify cause.,Shake step have professional help hot walk interview keep conference sign central.,2025-01-07,2024-10-03 03:06:04+00:00,2025-09-02 19:11:50+00:00
577,10,Finish_42fb0b,Million_fe8b6c,joelmurphy@example.com,He customer election family story now full claim skill civil daughter drive.,Night until arrive fine general board.,2025-11-14,2025-09-07 04:53:46+00:00,2026-01-09 23:12:30+00:00
578,6,Herself_3c9b5a,Commercial_f4225d,owenshannah@example.net,Trouble moment decade two hour ability citizen.,Age few long my traditional once oil water.,2026-05-22,2024-08-19 03:30:26+00:00,2025-08-11 12:58:05+00:00
579,9,Less_34144f,Kind_a56dd0,jennifermorgan@example.org,Similar political bit room if month choice.,Customer play sister few themselves leader seat simply remain instead story program.,2024-01-11,2025-05-17 01:07:37+00:00,2025-08-07 05:08:53+00:00
580,8,Once_81d17c,Star_b003bb,bferguson@example.org,Bar might right probably over vote black significant mother traditional her not.,Thing reveal service street him executive summer image leader.,2026-10-21,2025-05-28 09:19:20+00:00,2024-07-18 22:38:39+00:00
581,3,Important_f0235d,Fight_d44c0a,jeffersonscott@example.org,Parent system with shake medical under among may.,Case drop situation occur car newspaper.,2024-10-07,2024-05-10 18:57:18+00:00,2025-11-04 01:58:42+00:00
582,4,Try_36b984,Product_d9263e,kimberlyknight@example.com,In speech business wait hotel single college officer do see.,Measure model ask method door end capital against child produce.,2024-03-18,2024-03-02 23:47:13+00:00,2025-03-21 22:22:37+00:00
583,12,Big_47ac65,Law_aad54a,teresa21@example.com,Skill again air bring try now push consider recently food program.,Bit kind common card eight explain.,2024-08-11,2025-05-30 00:32:35+00:00,2025-02-04 22:38:59+00:00
584,1,Dream_3d6e6d,Energy_1728cc,richard36@example.net,Possible radio language oil join sister great early cut.,Consider benefit though evening citizen morning somebody evening nature home magazine.,2025-02-18,2025-05-07 11:51:58+00:00,2024-08-20 17:56:34+00:00
585,5,Kind_621d9c,Amount_7fb1f7,gonzalezjanice@example.org,Suddenly blue radio war development director town computer organization.,Situation perform company buy culture show some live successful result.,2024-02-16,2024-08-26 19:55:28+00:00,2025-06-21 00:11:08+00:00
586,4,Life_53a076,Fly_013122,bryan85@example.org,Turn clear peace whether and approach already this clearly science job follow member.,Either resource economic personal boy water often.,2024-07-17,2024-01-17 12:19:58+00:00,2024-09-26 06:54:17+00:00
587,10,None_9616c6,Design_b75c09,swalker@example.org,Newspaper than act eat with surface against girl others.,Clearly federal discover buy name financial.,2025-07-29,2024-02-20 17:58:57+00:00,2024-11-14 21:35:48+00:00
588,2,Property_fab801,Skill_9ed1e1,xlambert@example.org,End keep spend what federal remain feeling business between magazine.,Often art response record agreement feeling senior thank score side picture matter.,2025-01-04,2024-02-25 02:27:40+00:00,2025-10-28 16:11:02+00:00
589,1,Itself_8e4800,Generation_8c9de8,aliciawalker@example.com,Power newspaper action thousand part look recently alone team item push.,Relationship term pass leg management hope region around once.,2026-01-21,2025-02-02 18:02:24+00:00,2025-09-10 08:32:10+00:00
590,12,Similar_b715ac,Simple_050194,eddie35@example.com,Let American personal seem check PM.,Information imagine source in large accept many effort ask whom shoulder professor.,2026-03-07,2024-04-03 21:46:44+00:00,2025-04-22 16:05:48+00:00
591,6,Myself_70eaa4,West_0b882d,kylie87@example.net,After son fact draw ground less structure painting second effort report body.,When evening time class nation explain ten father song majority study always consider.,2026-07-23,2024-01-24 00:49:14+00:00,2025-02-09 12:44:36+00:00
592,11,History_15f200,Analysis_fb309e,davidcarpenter@example.net,Lead change interesting commercial enjoy reveal race partner goal toward service box many.,Across smile south southern type hundred her no technology water standard nice soon.,2026-11-08,2025-01-19 03:02:34+00:00,2025-12-29 11:49:44+00:00
593,7,Wrong_d24cbf,Identify_2c5eec,zcoleman@example.com,Across lay option become war least get skill Democrat indicate professor human.,Test able down trial soon explain.,2026-11-01,2025-03-02 06:45:06+00:00,2025-04-07 03:17:37+00:00
594,12,Paper_7e393f,Safe_e4d5b9,tommyfaulkner@example.com,Without arm direction brother former only past attention.,Manage or air performance which most record nation.,2024-03-16,2024-11-06 04:00:46+00:00,2026-03-09 07:50:51+00:00
595,3,About_8453e8,Company_5abdf4,omarcarroll@example.org,Season forward police shoulder PM heavy themselves.,On just eight pick story tax power project still financial let them.,2025-09-29,2025-06-07 15:39:54+00:00,2024-08-22 10:23:56+00:00
596,6,Nice_7883a7,Seem_e5591c,pricedillon@example.net,More event expect world national southern end position instead against charge mission manage condition.,Really prepare great even store save strategy whether.,2026-05-31,2024-09-26 13:39:02+00:00,2024-12-25 11:31:11+00:00
597,8,President_f9a747,Close_180076,garciafrank@example.net,Maybe result full modern behind age pass moment human course wish raise.,However people person everything what poor our thank night whole.,2024-11-13,2024-11-26 16:47:58+00:00,2025-09-03 21:39:20+00:00
598,11,Break_98186e,Spring_bd2d7d,marc29@example.com,Soldier responsibility election appear seem what wonder air huge question vote.,Thank toward night lay say bad through condition his weight man.,2025-10-27,2024-02-01 12:21:20+00:00,2024-06-22 14:27:32+00:00
599,5,Name_1abba2,Fish_ec3df2,john58@example.org,Beat level nearly move foreign stage term education.,Place notice drug guess beat clear ago.,2026-01-10,2025-03-29 16:40:11+00:00,2025-12-22 03:27:37+00:00
600,7,Worry_4ec80c,Spend_495251,henry69@example.net,Suffer about along almost turn official necessary life level purpose also send.,While what ready west level political fact whom moment experience analysis.,2026-10-18,2025-09-14 12:00:03+00:00,2024-08-20 10:18:29+00:00
601,6,Concern_ea57c5,Time_3ae2c7,angela49@example.net,Detail perform use floor imagine push such medical create realize.,Skin teacher trial all detail indeed remember official development.,2026-11-07,2025-02-09 14:46:34+00:00,2025-12-09 06:56:40+00:00
602,9,Bar_f873c5,Reflect_5e072f,johnsonronald@example.net,Plan analysis once most example radio difference yourself check officer.,Ready determine box defense property worry suffer growth sing simple contain thank eye.,2026-08-10,2025-12-22 03:11:35+00:00,2025-06-28 04:18:55+00:00
603,3,Thing_47fa71,Car_2f83d3,eturner@example.net,Nature require involve father black adult investment.,Human create act behind east floor action be here identify.,2025-04-12,2024-06-09 18:57:50+00:00,2024-07-01 22:22:10+00:00
604,6,Increase_f0bb55,Account_0e9d06,xmarsh@example.org,Media land plant same as rock program somebody individual.,Major shake place those week week while subject shake.,2024-12-08,2024-06-24 17:14:26+00:00,2024-08-19 06:59:57+00:00
605,2,Fear_81fb9a,Three_a48d2b,glen87@example.net,Partner by different happy candidate Congress range brother in form particularly bill to.,Experience see stuff institution approach turn keep environmental consumer rich ask.,2026-12-14,2024-06-20 14:12:39+00:00,2025-06-16 04:52:35+00:00
606,10,Dream_ae8f51,Democrat_efd004,qmoreno@example.com,Tree act nearly where wide huge among tonight improve you simple unit hard.,Miss enjoy method question dream true while fly management TV.,2024-07-23,2024-10-28 05:05:03+00:00,2024-12-15 16:29:16+00:00
607,6,Project_c5d74f,Into_144e9f,katherinefisher@example.com,Imagine people radio modern catch such baby.,Authority month raise somebody individual should player line trip space college method say however.,2026-06-07,2024-12-30 13:39:53+00:00,2024-11-20 06:52:33+00:00
608,2,Relationship_0131d5,Approach_32cd34,christopher80@example.com,Similar finish really agreement defense picture collection.,Option water change establish this girl hot us medical.,2025-08-05,2024-01-22 16:49:04+00:00,2025-02-14 22:10:25+00:00
609,6,Give_83b37c,Avoid_b006b6,crawfordrachel@example.net,She most education fund office consider threat others here animal game.,Rise source bar line him road college catch activity.,2026-07-03,2025-12-24 08:16:02+00:00,2024-07-25 21:45:26+00:00
610,7,Light_4428e8,Ago_cbe2a1,melissa08@example.net,Inside smile artist sister prepare community explain role in.,Must mention face computer chair career way our than through price.,2024-05-08,2025-06-02 21:39:01+00:00,2024-08-21 02:55:26+00:00
611,1,Than_ff33fb,Window_57a325,marissajacobs@example.net,Part fund performance officer wish network.,Foreign position whole program statement interest page marriage deal right.,2026-08-11,2024-03-29 15:19:39+00:00,2025-02-05 01:03:37+00:00
612,3,Hair_af14fb,Serious_e8cef8,jeremy87@example.org,Page onto seek reality order page remember executive main but begin whether.,Feeling involve stuff new health home treat apply.,2024-08-16,2025-11-14 07:01:48+00:00,2025-01-01 06:55:44+00:00
613,12,Along_93e4e6,Industry_12a866,olivia60@example.com,Professional design early section bag back author man nice teach.,Wait those simple more onto Mr owner like century.,2025-09-27,2024-11-09 03:10:28+00:00,2025-11-01 23:35:23+00:00
614,6,Show_db3f97,Worker_19650b,vmayer@example.net,World particular skin say ask quickly find.,Machine last south concern every on election certainly although understand hear former next campaign.,2026-06-08,2024-04-09 00:01:23+00:00,2026-06-10 16:00:37+00:00
615,1,Push_8cdf42,Road_a780da,ggonzalez@example.com,Continue large return approach national weight mouth include only.,Hospital upon different capital newspaper poor.,2026-07-09,2024-11-01 07:46:14+00:00,2025-09-23 08:46:59+00:00
616,5,Environmental_678e11,Rich_8ce163,martinezsherry@example.net,Determine experience course decide not house beyond light.,Rock local box record role Mrs home summer though.,2024-06-24,2025-07-03 11:42:47+00:00,2026-01-28 02:02:14+00:00
617,9,Not_0147cf,People_4c875c,julia39@example.org,Friend other garden imagine key now.,Goal central term consider pick enter third white.,2025-08-23,2025-10-02 19:27:53+00:00,2024-06-27 18:06:29+00:00
618,8,Several_5df31a,Site_929724,timothy95@example.net,Half experience whom receive certain hard mouth simply half stand minute.,Behind control threat follow break money.,2025-04-24,2025-06-24 12:07:37+00:00,2024-06-20 20:37:11+00:00
619,4,Tough_1b4ca0,Voice_5ca4b8,emarshall@example.org,Discuss off skill provide human true in case decision.,City fear lot just peace rest section actually appear.,2025-02-12,2024-02-06 11:41:32+00:00,2025-12-14 15:49:49+00:00
620,2,Line_1272c2,Risk_91a359,michael55@example.net,Seek explain toward somebody structure pretty voice glass amount.,Most various which since value fall both culture reach PM staff myself keep.,2024-05-19,2025-04-07 03:57:24+00:00,2025-04-01 17:36:05+00:00
621,10,Yourself_d70cb4,Star_c5f9d1,andrea82@example.com,Require memory movement agency thing tough prevent suddenly ok mind step.,Newspaper option room now theory free near data.,2026-09-17,2024-10-31 00:58:28+00:00,2025-02-06 11:11:09+00:00
622,7,Into_b2c941,Give_47c619,qmiller@example.org,Develop finish try ask forward together beyond state middle.,Tend life process structure win inside.,2025-04-13,2025-12-08 03:41:48+00:00,2025-08-21 01:25:52+00:00
623,7,Series_134cb6,We_d74925,doylekenneth@example.net,Number security outside care center marriage loss realize reach member onto we such.,Man thought economy much up sister leg out student.,2026-02-23,2024-11-07 20:46:32+00:00,2025-11-07 06:33:18+00:00
624,9,Decade_cccb24,Thank_cd0647,veronica51@example.org,Ground level catch from tree example we or executive TV campaign.,Hit write career exactly receive grow provide.,2024-07-17,2024-04-17 08:59:08+00:00,2024-05-10 16:18:40+00:00
625,7,Enjoy_f46291,While_2ab8e5,nathaniel84@example.org,Other fish guy structure chance officer product focus lawyer.,Add vote resource leader tend between relate group.,2024-04-14,2024-04-24 09:18:07+00:00,2024-09-15 13:03:09+00:00
626,6,Spring_89c7ae,Level_5219a2,angela66@example.org,Attack speak music watch site treatment world hair world interest perhaps.,Manager structure include event exist build knowledge pick rock hand.,2024-09-20,2025-07-25 07:54:28+00:00,2025-06-16 03:43:45+00:00
627,10,Stay_7bce58,Put_ae0624,ghughes@example.com,Yes gun enough rest cell policy customer check add draw.,Happen brother sister gas investment firm.,2025-12-28,2024-07-30 18:48:13+00:00,2025-05-11 23:21:54+00:00
628,9,Child_c01177,Decade_09437e,martinezkimberly@example.net,Similar south national life that city happy big official.,Debate like those class people huge morning sense song.,2026-10-30,2024-08-13 11:53:55+00:00,2024-06-21 13:50:41+00:00
