employee_id,hotel_id,first_name,last_name,email,role,employment_status,hire_date,created_at,updated_at
1467,7,Only_286309,Size_ec5087,colekeith@example.org,Opportunity indicate available plan success environment war young.,Exist care break piece skin ahead me.,2024-09-29,2024-09-05 13:44:40+00:00,2024-11-07 07:46:43+00:00
1468,2,Surface_f572b6,Help_56ac99,bjohnston@example.org,Adult idea country less throughout Congress.,Cup life spring believe present because represent travel way government for use.,2025-08-21,2024-03-31 06:56:18+00:00,2025-11-02 18:34:51+00:00
1469,11,Return_e84a33,Energy_5dc7bd,lopezmadeline@example.net,Under best every according another Democrat.,Industry ever under reveal able child program.,2024-06-25,2024-09-11 10:42:32+00:00,2026-06-07 16:31:10+00:00
1470,1,Expert_d37994,Piece_d0c879,carrwilliam@example.com,Doctor need court morning end bar whose provide politics cut visit.,Dog very far performance Mrs mind power enough worker realize.,2026-12-02,2024-12-06 06:56:21+00:00,2025-08-15 11:23:05+00:00
1471,8,Worry_33843f,Get_b585e7,vgriffith@example.net,Shoulder only management size ahead force run his skill performance nor benefit.,Prepare far live apply whom ten down attention structure than.,2026-03-24,2025-11-28 01:12:17+00:00,2025-06-13 01:34:18+00:00
1472,10,Rest_b3648a,Believe_24eb80,michael04@example.net,Doctor sure assume food first common about easy.,Matter can impact model everyone fall difference subject throw especially alone animal.,2024-10-30,2024-03-19 04:06:26+00:00,2025-02-25 02:42:43+00:00
1473,11,Could_d62def,Can_ab58cf,floresdawn@example.com,Happy main song until visit camera keep paper collection through.,Allow number so partner themselves together.,2025-05-19,2025-06-14 07:35:29+00:00,2024-09-16 18:50:20+00:00
1474,8,Very_9fe87f,Think_56e261,brittany36@example.net,Argue early certainly discuss building front table.,Show free low available sound yet thus red defense event view.,2026-01-02,2025-11-26 02:28:45+00:00,2024-07-25 06:00:29+00:00
1475,7,Member_d38cd9,Store_a42b9c,santostimothy@example.com,Drive class air rest air matter show least bag resource today.,How blood deal another couple key trouble respond health choose make.,2026-02-26,2025-09-08 05:08:16+00:00,2025-09-06 10:26:03+00:00
1476,9,Nice_60c029,Develop_4cf9b8,reidjennifer@example.org,Man environment strategy already hundred father address with gas dark name.,So participant federal reflect why page realize thank their carry then.,2025-11-07,2024-01-15 18:09:16+00:00,2024-10-28 09:40:59+00:00
1477,1,Number_3baaad,Answer_1a85c8,crystalobrien@example.org,Can big pull here conference realize stay.,Pick bag eight hundred include her themselves fire interview full nation admit.,2026-02-25,2025-01-23 10:59:04+00:00,2025-07-11 15:41:28+00:00
1478,11,So_4f8a07,Natural_372bc3,katherine54@example.org,As successful sport itself military consumer necessary can star shake through second sing.,Baby sing wear artist after money according this represent born peace husband.,2024-02-29,2025-03-09 19:37:31+00:00,2025-04-03 09:59:17+00:00
1479,12,Meet_22cf15,Tell_f76f56,simmonsmichael@example.net,Example similar feel court relationship modern good type list do security hold.,Local cause respond field serve doctor political seat series now candidate.,2026-06-11,2025-09-21 01:33:17+00:00,2026-02-12 04:33:43+00:00
1480,10,Do_d376d7,Anyone_294e4b,zgonzalez@example.com,Growth school month fund student senior sea give shoulder decision on always structure.,Pass yet put bill yet million.,2024-11-18,2024-06-17 23:25:35+00:00,2024-12-24 09:38:17+00:00
1481,8,Man_6f44c7,Act_04b385,eugene02@example.net,Add half force her president trouble grow development.,Involve test show keep no sure number special thousand know institution month.,2024-03-31,2025-04-03 22:13:36+00:00,2024-05-13 21:49:26+00:00
1482,3,Scene_51af82,Rather_d25a6b,tperez@example.com,Four career up oil end cup.,Space old beat actually cell power know yes wonder window every medical film hotel.,2025-03-19,2025-10-06 14:47:03+00:00,2025-10-21 07:16:36+00:00
1483,9,Provide_74bfb8,Book_fd8042,linda95@example.org,Heavy range serious yeah performance example especially position event forward one coach increase.,Reveal great produce whatever number imagine.,2025-12-03,2024-07-27 19:15:32+00:00,2024-10-14 01:43:55+00:00
1484,8,Particularly_2c0f55,Yourself_6dfed4,xfreeman@example.org,Gun difference into majority argue kind along garden wear law always five name.,Rock type gas season view Congress.,2026-11-03,2025-02-12 22:33:55+00:00,2025-08-01 21:52:48+00:00
1485,4,Ask_8d6560,New_2cb0cd,erin39@example.net,Color training expert record difficult trip less across final knowledge while.,Yes future year cause any trade establish administration director what.,2025-08-23,2025-02-15 23:30:03+00:00,2025-09-11 16:49:16+00:00
1486,3,Allow_1c5ff0,Bring_5b829a,aaron01@example.org,Tree draw production major lose well argue.,Girl hospital large break democratic coach before pass form nature student.,2024-12-17,2025-06-09 03:04:57+00:00,2024-09-28 04:36:55+00:00
1487,2,Same_9baf95,Sort_9def18,vwhitaker@example.org,May begin piece international response such instead claim report him east better walk.,Business attack ground on political president small knowledge else direction she add charge.,2024-09-24,2024-03-15 02:06:24+00:00,2024-04-18 00:45:02+00:00
1488,4,South_cfa8c7,Hospital_57f172,stacy02@example.com,Author child state party though wall method bank court through fine.,New film wait anyone cup hope change easy begin allow police those.,2024-07-25,2025-06-29 05:31:31+00:00,2025-10-02 00:17:03+00:00
1489,11,At_def149,Another_cfc0c6,hardybetty@example.org,Half painting generation happen hold help.,Buy begin air everyone voice perhaps dog next base.,2024-06-27,2024-06-10 04:52:17+00:00,2025-01-05 00:01:53+00:00
1490,12,Day_bc6b1b,Data_38d8d2,foxrachel@example.com,Song near factor soldier crime society next prepare exist.,First could which while sound other three fight man sure.,2026-12-12,2024-05-08 17:28:48+00:00,2024-06-04 01:38:37+00:00
1491,4,Easy_d36730,Late_053e44,meltonalbert@example.com,Strong you plant begin this enjoy after.,Former others long wonder plant expert art usually blue do skin case poor almost.,2025-10-15,2025-06-06 12:30:48+00:00,2024-08-25 21:11:28+00:00
1492,10,Development_44cfff,Perhaps_6d19b5,wgraves@example.net,Wide old simple image head fight pressure spring.,Present until population face executive environment win their our as fall hope focus.,2025-03-05,2025-03-17 05:46:35+00:00,2026-03-07 15:22:04+00:00
1493,8,Instead_69593d,Gas_8eeef6,jamiecamacho@example.net,Turn six stand offer conference today open rather strong woman kitchen.,Friend base listen ok produce majority well rest again draw.,2024-10-06,2025-06-20 02:09:16+00:00,2024-08-11 21:00:59+00:00
1494,7,Simple_f05fb5,Feel_251f2d,barbaraford@example.org,My risk where improve camera least store position.,This decision executive strong pick movement room determine town put.,2024-07-31,2024-05-15 16:54:37+00:00,2024-12-02 00:48:50+00:00
1495,3,Play_3d2ed1,Develop_494a9b,michaelfrye@example.net,Do traditional left way mention call return product.,Interview through series organization audience not magazine.,2024-03-09,2024-03-27 01:44:21+00:00,2024-11-02 19:38:08+00:00
1496,11,Court_08d431,Exactly_ec3f99,snovak@example.net,Training he without TV manage member point itself hospital race take check thousand.,Relationship no really wife themselves least nor Mrs just hope.,2025-12-12,2025-11-08 13:09:19+00:00,2025-10-04 07:21:15+00:00
1497,10,Send_f6d66c,Body_8a44c6,lisa84@example.org,Leg take reach mother ago behind.,Task over center late join compare oil air particular.,2026-08-12,2025-06-02 23:11:06+00:00,2025-01-09 10:24:15+00:00
1498,8,Probably_abf418,Drug_bace0e,smithcarlos@example.com,Sit project ball top plant pass effort section employee.,Agent particularly worry rise with offer its PM bring over describe mean six.,2026-11-24,2024-09-10 17:36:15+00:00,2026-01-26 10:12:56+00:00
1499,1,Half_d0871e,Road_cc8f7c,erichall@example.com,Only three dream growth similar watch up wish miss activity seat.,Yes agent issue rate character former choice.,2025-02-15,2024-04-30 14:35:08+00:00,2024-10-31 04:23:10+00:00
1500,4,Expert_1e152f,Enjoy_547252,garzaryan@example.net,Fight staff very candidate decision maybe ability indicate home know tonight fish.,Early best four yard shake article rich someone challenge rich through.,2024-11-29,2024-10-19 17:53:10+00:00,2025-06-30 20:16:07+00:00
1501,8,Top_b733bb,Student_0dde2c,barreragary@example.net,She blue catch player fact take wish box lose rate feeling.,Almost country song wonder certain person wear job watch theory determine.,2026-07-14,2024-01-26 18:25:35+00:00,2026-03-05 20:25:26+00:00
1502,12,Hard_29ccdc,Blood_132d3e,mooredana@example.com,Miss season western financial agreement allow recently.,Yes over today fish nice service teach recent magazine between reflect attack enter.,2026-05-04,2025-05-04 17:10:47+00:00,2025-04-06 04:25:29+00:00
1503,6,Cold_8faba3,Success_77e6c3,kathleen42@example.org,Paper scientist increase often that box crime season establish radio door expect.,Leader enjoy value film each management professor allow price phone water along market.,2024-11-17,2025-12-29 15:29:16+00:00,2024-07-21 03:23:28+00:00
1504,4,Director_513350,From_e651b7,garrett69@example.com,Whatever energy participant gun system just cause become dinner street compare.,Will PM sometimes unit trip then way kid kind become.,2024-03-10,2024-03-03 15:45:32+00:00,2025-10-16 11:08:40+00:00
1505,11,Will_43747a,Peace_79bfe7,linda08@example.net,Impact know behavior shoulder human from.,Start response arrive thank memory gun small process should movement chair.,2024-09-04,2025-02-25 11:41:04+00:00,2026-01-07 18:20:40+00:00
1506,11,Adult_354247,Indeed_9bf6ce,lori59@example.org,Yeah suggest need seat notice east board open.,Individual structure mean go today start ten happy.,2024-12-23,2024-11-06 05:05:43+00:00,2026-04-14 02:48:06+00:00
1507,1,Attack_fff111,Color_a1bb99,mtran@example.net,Community safe from him form now effect local foreign.,Player president include live onto major benefit cup national.,2025-04-04,2024-12-09 16:29:07+00:00,2026-01-25 18:57:20+00:00
1508,2,Eat_71fcc1,Doctor_bc1179,tbarnes@example.org,Work understand pattern customer chair later bad.,Religious boy piece opportunity focus detail happy recently.,2025-04-15,2025-04-25 15:42:42+00:00,2024-04-26 08:00:24+00:00
1509,8,Source_93bb96,Here_ee6afb,david86@example.com,Go economic reveal read marriage operation goal performance house adult ten.,Price identify nature paper clear young arm.,2026-02-04,2025-06-19 02:14:30+00:00,2025-06-03 01:05:00+00:00
1510,12,Daughter_cb0337,Teach_0e65c0,kathryn71@example.com,Community physical material nothing truth lay support.,Situation race bank chance card street job character.,2025-05-30,2025-08-08 14:28:13+00:00,2025-11-01 18:20:58+00:00
1511,4,Read_152916,Matter_fae4bc,richardwoodard@example.com,Possible score describe several thousand imagine prevent put happy.,Middle responsibility method practice new final.,2026-02-22,2025-05-22 13:07:13+00:00,2025-09-03 08:50:08+00:00
1512,10,Agreement_699c94,Rule_5e7061,chanjody@example.org,You third international majority week both find face strategy above size bar eight.,Eat leg sport air should interview white them material bag although smile.,2026-12-20,2024-07-19 23:51:54+00:00,2025-11-24 22:27:20+00:00
1513,11,Shake_201b1b,Week_4ee9ed,cdavis@example.org,Loss red answer school debate source because alone door.,Offer be three without quality air lawyer.,2026-01-28,2025-10-09 17:09:21+00:00,2024-02-07 15:21:28+00:00
1514,6,Personal_5cbd7e,Work_7cb8f4,teresanichols@example.net,Buy moment sport which step low wrong.,Shoulder actually act over method arm since will authority.,2026-09-18,2024-10-22 11:50:08+00:00,2025-04-24 09:03:36+00:00
1515,1,Sea_0256bb,Production_2ed409,crawfordjonathan@example.net,What south wish talk fast practice.,Partner indeed improve character action town build probably.,2025-03-18,2025-10-19 20:58:49+00:00,2025-05-07 13:21:52+00:00
1516,1,Century_fdbbac,Ok_9febf0,jodonnell@example.net,Tonight whom family true provide only with particularly bank occur nature.,Bad hundred rather family center work character song economy.,2026-09-14,2025-06-22 08:24:46+00:00,2024-08-24 04:25:21+00:00
1517,4,Practice_9b55cf,Red_1928f4,zachary95@example.net,Successful successful with produce over final conference relationship society into population beat wait.,Prevent have arrive before fine total other study.,2024-03-31,2025-02-10 01:43:03+00:00,2024-08-11 04:58:12+00:00
1518,12,Very_ebae09,Decision_3dc728,jamie85@example.net,Home word city name green character whatever offer mean friend score.,Enter responsibility something if former fill five series range.,2025-01-29,2026-01-08 01:27:56+00:00,2024-05-21 21:35:52+00:00
1519,1,My_ef6896,No_3834c4,kellyknox@example.org,Two six husband must idea make region federal away outside popular morning doctor degree.,Heart total involve add though fine crime throughout affect wind learn.,2025-01-30,2025-08-12 05:33:37+00:00,2025-09-25 04:56:27+00:00
1520,5,Full_859523,Society_956e04,brookemacdonald@example.com,Listen scientist hear own require form.,Born ever vote magazine whole exist charge cell anyone soon candidate move.,2025-04-05,2025-10-08 20:42:38+00:00,2025-05-03 04:18:52+00:00
1521,3,Hour_21e43b,Fly_f597c2,meganlopez@example.com,Within fire program live meeting group other include add me fire memory.,Dog every property throughout study performance condition small fire family.,2026-08-05,2024-02-05 23:29:41+00:00,2026-04-12 07:30:09+00:00
1522,11,Effect_a0bdca,Could_9b36c6,daviddixon@example.org,Born both student culture miss service east expect instead example paper key.,Poor begin hear everybody end prepare prevent up.,2026-10-01,2026-01-01 22:23:37+00:00,2026-04-25 18:28:59+00:00
1523,1,Break_0d31d5,Teacher_8e99f6,norrisalicia@example.net,Every material history clear war spend size film story away east.,Window morning it budget someone law floor.,2024-05-23,2024-03-18 06:08:47+00:00,2024-07-19 06:04:31+00:00
1524,9,As_848542,Five_575db2,david52@example.net,Soon practice your require exactly concern of.,Impact maybe inside arrive far opportunity significant sense participant thus paper.,2024-11-21,2025-03-31 06:38:24+00:00,2025-08-09 13:23:32+00:00
1525,10,Option_76c858,Memory_7e7065,sara72@example.com,Morning rather top why name left yourself article style.,Price particularly loss throughout it travel while.,2025-03-08,2024-05-18 04:34:56+00:00,2025-11-25 03:24:23+00:00
1526,9,Property_1647e4,Difficult_83fccc,qjackson@example.com,Hour small great along movement we.,Listen need something detail full Republican.,2024-08-09,2025-01-14 22:59:33+00:00,2024-06-16 21:19:14+00:00
1527,8,Line_728d05,War_3e2202,lucerorichard@example.com,Story southern themselves from street by.,Them subject spring affect believe list.,2025-05-02,2025-12-03 05:44:49+00:00,2024-05-06 21:53:16+00:00
1528,4,Might_1bc103,Member_943683,daltondenise@example.org,Whatever student carry yes ability wall store floor forward wall question some receive across.,Quality state life gas cup house five fight employee true bit.,2025-07-26,2025-02-10 22:12:04+00:00,2026-04-20 08:15:32+00:00
1529,10,Several_9a5a79,Bit_56e6a6,daniel96@example.net,Great either next could run grow.,Rock give medical girl including far each low college free.,2026-04-21,2025-02-17 12:19:21+00:00,2025-05-18 03:28:39+00:00
1530,3,My_661efb,Exist_32e372,lisa19@example.org,Old may natural certain senior analysis quality upon chance recent figure push.,Fill month buy ability body side food floor few.,2024-02-15,2025-12-22 05:00:20+00:00,2024-08-27 06:45:57+00:00
1531,4,View_6a5b93,Commercial_1fd910,zmorales@example.net,Clear book beat to chance picture.,Middle fear fact thousand former sport talk.,2025-09-17,2026-01-05 12:32:27+00:00,2025-12-14 17:22:00+00:00
1532,2,Field_ebd496,Herself_0ca626,singletonkathryn@example.net,Present a contain take at certainly now trade man list.,Price ball that people alone gun assume already big.,2025-07-02,2024-05-01 03:29:09+00:00,2024-08-27 06:52:31+00:00
1533,9,Foot_87b0b4,Avoid_e85189,roberthamilton@example.net,Series inside state once west order majority choose deep main write.,Hair exactly exactly sense natural nature affect.,2024-09-01,2024-04-17 17:16:09+00:00,2025-12-07 17:41:00+00:00
1534,8,Quickly_6e57e1,Protect_fb3dad,talvarado@example.net,Right feeling win nature society leg wind course.,Break side end situation her anything very other ok argue.,2026-01-07,2024-11-07 19:05:18+00:00,2025-09-10 18:32:07+00:00
1535,11,Down_29bcd6,Growth_4b6dd3,johnsonkaitlin@example.net,Improve job buy bed change measure think.,Anything thousand husband nation clearly drive also authority movie.,2026-08-25,2024-08-31 18:22:03+00:00,2026-06-04 03:09:41+00:00
1536,11,Listen_3a5fd0,Serve_e71b0d,william42@example.com,Natural evidence step leave look road.,Father understand reach thousand reflect sure.,2024-10-25,2024-04-13 12:34:09+00:00,2025-05-07 08:13:50+00:00
1537,8,Happen_436d55,Especially_d2bd93,ybishop@example.org,Point bed man leave go growth would wear power ok.,Door number them practice safe process speech cause enough suffer smile price.,2024-03-30,2025-11-08 16:09:42+00:00,2026-03-11 15:23:31+00:00
1538,10,Her_01f8be,Experience_07a686,jcook@example.com,Would manager threat company even draw for cause imagine.,Throughout artist work rich news yard water employee material money traditional past research.,2024-09-01,2024-12-25 12:21:56+00:00,2025-02-02 16:08:21+00:00
1539,9,Arrive_c20625,Catch_68dbc4,kristarobertson@example.org,Responsibility by me although cultural threat key past.,South reflect court cold method there result.,2024-02-25,2024-05-03 02:59:24+00:00,2026-02-04 14:59:14+00:00
1540,9,She_2fcd1b,Claim_ef1bd7,greendavid@example.com,Issue office ground because newspaper example.,Need note draw development choice ability discussion news something camera enter near.,2026-10-04,2025-07-13 09:46:22+00:00,2024-07-01 08:19:21+00:00
1541,11,Political_78bade,It_a3a6ef,karen90@example.net,Glass control account boy product save star least record stop here.,Real claim shake just blue ago remember beautiful find amount mouth city star.,2024-06-16,2025-09-15 01:55:26+00:00,2025-06-20 09:28:49+00:00
1542,1,Left_381ac1,Either_d9df11,matthew49@example.com,Sister catch meet industry always rule fast everybody.,Country human hit one strategy on wait.,2024-02-04,2025-02-23 08:49:07+00:00,2025-02-10 21:23:49+00:00
1543,1,Must_a36684,Ten_4f9d7a,frankmoss@example.net,Recently health local whether authority draw sell the wait you.,Century crime improve shake dinner future church piece book.,2026-12-10,2024-04-06 18:33:23+00:00,2025-03-23 04:33:18+00:00
1544,8,Myself_e4b80f,Admit_a39a09,tonyaatkins@example.net,Maybe from marriage along instead drive interest civil financial hit up far need.,Single allow himself image goal generation seat.,2024-06-11,2024-04-20 16:49:23+00:00,2024-05-26 22:32:47+00:00
1545,9,Continue_d1b624,Prepare_1068f4,kylekaufman@example.com,Amount local may plan set project street check common allow.,Particularly sport reduce before politics stock pass.,2026-07-06,2024-11-05 06:42:51+00:00,2025-07-25 08:18:32+00:00
1546,7,First_91a177,Stand_70637b,travismaxwell@example.org,Many time time course benefit today.,Even floor strategy hear from light about evening as by.,2026-07-06,2025-09-10 09:57:47+00:00,2024-08-26 10:52:33+00:00
1547,5,Model_bc4b2b,Director_e99a35,oknight@example.org,Happy wide bit because near drop age.,Generation pass his democratic often writer bed recent beat threat language.,2025-12-13,2024-03-05 11:44:15+00:00,2024-06-13 03:18:50+00:00
1548,6,Tv_dd909c,Yeah_d6d4a1,leerachel@example.com,Quality most four result environmental personal what clearly management particularly common security.,Impact able else assume job site religious matter design.,2025-12-01,2025-08-19 10:41:38+00:00,2025-07-29 23:32:09+00:00
1549,7,Newspaper_b26c18,Under_f9ddae,stephaniechavez@example.com,Identify pretty consider significant inside soldier some build example woman media successful.,To recently sit he town Mrs hair president.,2024-07-14,2024-12-02 22:04:14+00:00,2024-12-01 12:01:27+00:00
1550,2,Deal_142099,Special_2e21eb,hyork@example.net,Bit happen garden try onto many voice test impact draw indeed animal toward.,Rather speech animal fire develop TV way special alone drop get.,2026-12-12,2025-05-27 15:05:22+00:00,2025-07-07 00:56:44+00:00
1551,2,Seek_008d86,Increase_983503,krystaldaniels@example.org,Reach model cover everything friend Democrat mouth later involve.,Great reason travel two question own nothing every however support.,2025-11-27,2024-12-14 15:26:56+00:00,2024-05-08 05:19:18+00:00
1552,9,See_860b8b,Maintain_d8b4f1,huangwhitney@example.net,A ever require free act specific among perform.,Decide pay simply place item try.,2025-05-09,2024-02-29 21:15:00+00:00,2024-07-25 01:21:34+00:00
1553,1,Raise_f5812f,Consider_c89d51,jpena@example.org,Various suddenly represent leave human before resource say or effort off the staff.,Federal shake since center start will significant do a current high tell most.,2024-01-31,2025-08-27 07:06:58+00:00,2026-03-15 22:15:39+00:00
1554,1,Nothing_b572c3,Single_0ffe4d,benjamin24@example.com,Interview establish blood hospital list while respond account remain lead protect red law.,Environmental hand admit skin production least outside.,2025-08-01,2024-03-11 17:47:51+00:00,2025-08-05 05:08:09+00:00
1555,11,Government_bd6bec,Dark_fafb12,kayla92@example.org,Reason happy scientist professional international question realize then while thousand view surface prove personal.,Also toward herself mind charge character art.,2026-04-21,2025-03-11 10:17:41+00:00,2025-10-07 04:37:44+00:00
1556,7,Street_115471,Change_0529bb,alexandershah@example.net,Move young sea politics agree quickly maintain peace.,Whether foreign up each her every now.,2025-04-14,2024-09-30 22:34:28+00:00,2025-06-15 23:42:12+00:00
1557,6,View_742141,Attack_9e6a14,gonzalezapril@example.com,Day across ask energy itself reveal.,Keep learn space finish because blood hear green pattern including.,2025-04-08,2025-03-14 19:53:56+00:00,2025-10-19 11:11:38+00:00
1558,9,Small_57b345,House_aacebb,tjones@example.org,Plant color list forget read home heavy impact.,Manager same mean seek you debate claim impact win.,2026-07-23,2025-08-03 04:51:54+00:00,2024-10-19 11:42:08+00:00
1559,11,Too_d33517,Far_d31623,sarah29@example.org,Reality hand charge past then market join just operation example.,If sign responsibility week as community suggest buy later.,2024-02-07,2024-12-19 12:33:24+00:00,2025-02-05 17:31:33+00:00
1560,2,Small_fd248b,How_08f14d,brandy97@example.org,Scientist plant until threat strong member probably join medical that gun call choice.,Fight white company leader message we mission article.,2026-06-16,2025-04-16 18:41:27+00:00,2025-10-21 18:55:37+00:00
1561,8,Any_016f35,Believe_4907be,adamscynthia@example.net,Many stay or away cell realize at.,While number big beautiful continue attention information prove.,2025-01-24,2025-06-27 18:39:53+00:00,2024-07-24 16:23:17+00:00
1562,5,Report_ebfdcf,White_9de9ec,cstone@example.com,His necessary laugh that term project poor level keep consumer whatever surface hour.,Understand camera data second case garden radio.,2026-01-19,2024-08-14 06:33:17+00:00,2026-04-21 19:55:26+00:00
1563,8,Under_cbe636,Leader_cc46f3,michaelbrown@example.com,Program recently if main major scientist court.,Result require behavior low performance cold standard available much somebody.,2026-09-22,2024-04-29 00:20:34+00:00,2025-01-26 20:24:49+00:00
1564,6,Down_fd1191,Voice_6b8b9c,nlara@example.org,Third third some act environment nation its leg.,Season movement worry war specific today article Republican analysis.,2026-02-19,2026-01-08 13:54:53+00:00,2025-04-28 07:11:11+00:00
1565,9,Late_4025c8,Trade_31d1a9,susan77@example.com,Law see identify attorney me able camera attack account company than radio.,Prove will actually management speech purpose have throughout room deal budget design no.,2025-05-15,2025-06-14 09:45:54+00:00,2025-07-21 19:24:53+00:00
1566,3,Measure_8334cb,Agree_77cd2c,susan26@example.com,After large sell director follow result else trade.,Arm visit challenge mean possible pay play support according rule eight.,2025-05-17,2025-05-04 12:36:09+00:00,2026-02-06 08:27:47+00:00
1567,6,Throw_a84343,Hospital_7830cf,pbutler@example.org,But myself fear them return machine.,Decade environmental next focus son leader body scene health early.,2026-02-28,2025-05-11 12:57:04+00:00,2025-01-29 08:47:26+00:00
1568,8,Back_e1c949,Nor_bb9fe8,qmalone@example.com,Leader purpose phone put hand personal along weight truth.,Practice cultural you both Mr two attack really financial us never.,2026-03-06,2024-02-17 04:55:44+00:00,2024-11-28 18:10:50+00:00
1569,5,Lead_8dcbd3,Democrat_50703c,lambbenjamin@example.net,Arrive billion off score field us toward reach mother center trip group radio.,War board still walk single white reason gun.,2026-11-10,2025-09-04 05:02:01+00:00,2024-07-12 18:12:37+00:00
1570,10,Improve_1fc55a,Red_e7d270,smcclure@example.org,Attack our as move adult population born over agreement notice senior.,Science risk enter specific manager seven career water interview lot war attack.,2025-03-22,2025-01-24 21:41:01+00:00,2025-07-13 19:39:58+00:00
1571,7,Long_1c2c55,Next_854e12,edwardrussell@example.org,Plant may claim property series analysis few oil.,Wait weight responsibility remain sit recent picture only choice whole leave.,2024-12-16,2025-04-11 21:55:20+00:00,2026-02-15 16:46:58+00:00
1572,9,Work_ea5488,Heart_5be6f1,sarah27@example.org,Peace approach his dream both next.,These bar current black source present.,2025-09-06,2025-05-05 13:43:31+00:00,2026-01-23 07:02:35+00:00
