employee_id,hotel_id,first_name,last_name,email,role,employment_status,hire_date,created_at,updated_at
1,11,Live_b30248,Teach_323742,rebeccaherrera@example.org,Ask everybody question second entire that leave any high back education.,Stay music even course hold turn within participant scene find.,2024-06-04,2024-08-11 17:48:23+00:00,2024-08-09 21:27:17+00:00
2,1,Various_0d36a4,Happen_11c8a6,casemichael@example.org,East eight senior these question future.,Its of true pattern do explain white tough down best six everyone itself.,2024-09-30,2025-07-23 20:24:50+00:00,2026-03-26 02:39:44+00:00
3,12,Any_f06131,Value_c07c4a,larrystephens@example.org,Stuff affect realize shoulder might too.,Make relationship environment put they sure party past.,2026-11-05,2025-04-22 17:46:11+00:00,2025-12-08 09:34:57+00:00
4,5,Control_bbc3c5,Born_999ca7,montoyarachel@example.com,Work big government late seek book where take manage point although morning.,Week decide imagine bar trip evening.,2026-05-08,2024-05-03 04:24:17+00:00,2024-03-27 11:43:53+00:00
5,6,Ok_4a3a04,Day_407999,lisamason@example.org,Owner skin plant site learn safe low life final reveal gas scene.,Everything age center measure too create rule single how season rather affect.,2026-02-10,2024-04-15 21:46:06+00:00,2024-12-10 15:32:31+00:00
6,12,Compare_3ef8a3,Expert_c8aea8,emma84@example.net,Out star well onto the box or simple idea term role she age.,Event gun situation rule structure during sing side girl difficult.,2026-04-29,2025-10-27 07:04:10+00:00,2025-08-07 09:51:47+00:00
7,2,Image_7bfb9e,Foreign_ce8c60,tanya87@example.org,Team Congress right understand child big travel would allow glass.,Spend store information his pass financial color treatment.,2024-04-03,2024-07-19 10:06:11+00:00,2025-06-12 02:39:41+00:00
8,8,Director_464896,Concern_0b149b,jennifer87@example.net,Three fact month argue should happen speak amount expert such.,Space resource write wind side number investment particularly.,2024-03-13,2025-12-29 07:20:24+00:00,2025-06-19 11:02:35+00:00
9,11,Role_2ed5fc,Your_872f23,cparrish@example.net,Including institution however memory service rock tough certain.,Purpose word PM although consider economy.,2025-10-13,2024-12-26 14:49:54+00:00,2025-01-22 16:27:48+00:00
10,1,Teach_08bcfa,Tell_428d58,jose54@example.org,Material answer day response close speak.,Surface lose heavy just above what sort dinner.,2024-04-27,2025-02-09 03:08:53+00:00,2025-12-07 13:46:10+00:00
11,9,Those_8ffc49,Service_6c7c25,wjohnson@example.org,Reason degree make education become glass push standard people rate.,Set so successful concern firm yet meeting week box win minute agree.,2025-05-12,2024-04-29 07:21:58+00:00,2025-11-18 20:13:07+00:00
12,8,Student_606209,Position_dd208b,michelle04@example.net,Fall between phone later interview film.,Might artist vote left water cost especially.,2026-07-12,2025-02-10 19:50:29+00:00,2025-10-20 22:30:29+00:00
13,11,Fund_f4e8d3,Marriage_a87e0e,jakelee@example.net,Almost open simply yourself free same kid see similar.,Economy something easy concern court scene south consumer indicate get situation school sister.,2025-11-05,2024-01-24 00:02:11+00:00,2024-06-22 16:05:56+00:00
14,1,Organization_647a36,Weight_95a9c0,christopherhull@example.com,Operation fund anything age artist reality area gun exactly.,Cover current teacher will though region.,2024-01-10,2024-08-24 12:47:25+00:00,2024-06-12 10:27:07+00:00
15,9,Drive_32ec6e,List_1882bb,tristanbarrett@example.org,Physical green decade chair clear for myself opportunity.,Practice color doctor exactly outside other weight stage statement dinner soldier recognize.,2024-06-18,2025-05-29 09:22:20+00:00,2025-05-15 00:23:00+00:00
16,1,Husband_455878,Strategy_63181f,liuwalter@example.com,Machine leg least public car point continue mind continue.,Doctor town week he benefit sure.,2024-10-03,2025-10-01 10:33:17+00:00,2024-10-29 10:34:46+00:00
17,10,Already_3dcdab,Fight_791069,vcasey@example.org,Low image nature federal today ahead president Mrs project positive age need Mr.,Local need send shoulder those during.,2024-08-10,2024-08-05 17:07:32+00:00,2025-03-02 18:57:07+00:00
18,11,Too_e1d619,Throughout_200b02,morganmario@example.net,Product beyond out ok up sea however dream yes.,Least language return population door sport everything pretty stay other move race.,2025-12-17,2025-07-16 06:08:17+00:00,2026-04-28 00:58:10+00:00
19,8,Water_ec7c4a,Lay_d99809,swilliams@example.com,Foot interest large science cold group throughout pattern range rich summer effort.,Teacher per itself choose age above itself character place.,2026-07-02,2025-10-03 07:02:07+00:00,2024-12-04 00:16:13+00:00
20,5,Significant_e20853,Bring_0aac96,josemitchell@example.net,Memory student condition stay grow friend city success suffer challenge.,Apply yes memory include sometimes job list account miss.,2025-07-05,2024-12-15 18:07:01+00:00,2024-09-17 23:52:21+00:00
21,12,Measure_4a792b,Call_bc4fc5,nbenitez@example.org,Can simply support Republican within attention idea worry.,Real project school about gas likely leader.,2024-08-08,2025-11-05 00:25:03+00:00,2024-08-13 19:03:52+00:00
22,3,Occur_6cf4b2,Give_2068c8,richard66@example.com,Piece leave rest smile performance recognize manager.,Give tend me onto lot carry.,2025-05-29,2025-01-10 03:28:58+00:00,2025-04-20 23:47:24+00:00
23,10,Let_d69dbc,Itself_9426ca,wadams@example.com,Administration any be everything age force factor future about himself.,Design son responsibility door economic may positive rock race buy international respond fish.,2024-06-12,2024-09-19 02:11:28+00:00,2025-08-04 08:38:40+00:00
24,2,Relationship_929e7f,Your_e7bc7d,ddavidson@example.com,Rate table work start weight behavior spend growth listen general.,Expect civil art economic still institution sell task.,2024-06-18,2025-06-07 10:16:36+00:00,2025-09-30 00:13:27+00:00
25,9,Example_662c08,Certainly_f331c5,nguyenmichael@example.com,Energy property PM speech development threat including type room traditional understand sport sort.,International at where staff assume edge force husband employee source.,2026-06-13,2024-05-06 18:42:10+00:00,2025-12-03 10:17:22+00:00
26,10,Audience_10ebcf,A_400b67,melissamanning@example.org,Be carry people black run still story.,Reason company major eat action exist direction.,2026-03-14,2025-04-30 02:25:56+00:00,2026-02-19 22:37:19+00:00
27,3,Force_cffc99,Which_d3c017,xbrooks@example.com,Magazine charge notice Republican statement situation else lot marriage.,Writer American air whose protect space oil under person threat.,2026-08-18,2025-09-20 22:02:04+00:00,2025-06-10 09:11:26+00:00
28,5,American_dc4b66,Experience_d0fb1c,dylan48@example.net,Sell decade clear dinner win though street rate only from ago degree already.,Future care heavy Democrat take city early book east should field.,2025-05-02,2024-08-29 09:56:02+00:00,2024-10-18 20:50:56+00:00
29,5,Keep_aab60c,Media_ddf83b,vlopez@example.com,Involve despite just hear occur author.,Religious southern high share wear second can road reason little.,2026-07-16,2025-12-12 03:19:12+00:00,2025-04-29 15:09:41+00:00
30,8,Appear_a31504,Whose_b95b66,ijones@example.net,Be live soon speech involve sense start job general way those seem west.,Country million thought detail area look quickly identify spring page.,2024-08-31,2025-07-16 16:16:39+00:00,2025-12-22 06:22:37+00:00
31,11,Manage_4eff21,Many_ba2b10,ucameron@example.com,Enter four real prepare popular need blue he positive.,Majority evening down political lead daughter person.,2025-08-25,2024-08-15 08:51:25+00:00,2025-01-13 15:28:10+00:00
32,3,Hot_a36539,Talk_c4dad8,campossusan@example.net,Staff door red father adult without manage present.,Why none protect onto environmental concern then and summer.,2024-06-25,2024-05-07 21:44:27+00:00,2025-11-04 03:57:22+00:00
33,5,Simply_ea42d2,Note_6e6418,lgilbert@example.org,Again detail business when method lot change long series federal.,Never easy spring example unit close.,2025-06-10,2025-01-04 12:09:31+00:00,2024-11-25 00:47:59+00:00
34,5,Measure_ab945c,Table_ee5e6b,edward34@example.org,Few million sometimes candidate chair score force age.,Somebody commercial away article edge relationship mission arrive could effort.,2024-04-03,2024-05-23 15:30:23+00:00,2026-01-01 01:17:41+00:00
35,10,Present_538954,Industry_1dc105,jhernandez@example.net,Still power north explain budget lose professor.,Call major hotel field wait major name.,2026-04-14,2024-11-18 22:09:07+00:00,2024-10-30 17:06:24+00:00
36,2,Final_7a2c1a,Mind_c427ab,john67@example.org,Republican also after third mother floor word grow short international avoid protect film.,Eye anyone money line money watch much each cover.,2024-08-31,2024-03-14 02:54:11+00:00,2024-07-09 18:20:34+00:00
37,11,War_81272b,Leader_2ca6b9,cathy70@example.com,Scene stand never enough feeling follow owner size season year blood.,Bit set argue American wait life modern management manage.,2024-11-04,2024-09-07 01:48:13+00:00,2026-01-26 06:04:43+00:00
38,5,Person_f453d9,Decision_ce2785,anthony95@example.com,Local public attack care live star.,Like trial say fine individual become.,2026-03-10,2025-04-18 22:24:37+00:00,2024-07-19 00:35:11+00:00
39,7,Avoid_d5ad77,Foot_3da894,npatrick@example.org,Newspaper wish professional they try himself part argue forget drive fly clear.,Pattern rate may national pull part need fund north.,2025-09-25,2024-07-09 23:02:54+00:00,2025-12-18 12:08:06+00:00
40,1,Cut_2c4760,Same_c8db2d,zjohnson@example.org,Population west up before outside fast choose performance.,Population interview not major cause ability step fast study.,2025-05-01,2024-09-24 20:29:08+00:00,2025-02-15 01:24:23+00:00
41,10,Manage_6242e5,No_3016fa,joneskristin@example.com,Others investment church clear rate chair.,Skin decide dog by find another company avoid outside local firm.,2024-02-05,2025-07-29 22:55:11+00:00,2026-03-23 10:42:25+00:00
42,8,Fine_8754ce,Detail_e15295,snyderrichard@example.com,Prevent if north executive time college center market inside court no other owner.,Eight star thus race chair throw partner scene under.,2026-06-01,2025-10-14 17:59:42+00:00,2025-01-16 09:15:46+00:00
43,1,Main_6e0d1c,Subject_a1a860,nschneider@example.net,Oil lead better medical area a economy tree charge before staff audience.,Professional away from chance forget surface commercial fund.,2024-10-10,2025-04-17 00:52:34+00:00,2025-06-11 22:42:21+00:00
44,11,East_6ad308,Bag_74e4ac,xpalmer@example.com,Position general together image man condition rock hard talk.,Likely food option pull bag law TV quality president dream city all.,2026-11-29,2025-07-14 00:26:04+00:00,2025-05-29 12:35:45+00:00
45,1,Down_31d763,Building_28fd19,rowetaylor@example.net,Strategy four would open man it international hot carry sister summer.,Professor look himself likely however teacher focus understand claim.,2026-02-11,2025-10-29 23:37:09+00:00,2025-05-22 17:58:41+00:00
46,9,Anyone_15755a,All_5f4de9,nnewman@example.com,Music operation society say finish song concern among same level very minute.,Son appear find water can drop one cut.,2026-12-29,2024-12-13 15:03:00+00:00,2024-06-29 11:42:15+00:00
47,1,Participant_0f5c4a,Trade_6a30a9,smithcharles@example.net,Product step pressure peace music chair.,Voice past treat main likely letter order event.,2025-12-29,2024-02-24 18:52:51+00:00,2026-05-14 00:25:42+00:00
48,7,Early_b5c58c,Recognize_057530,pacewilliam@example.com,Medical eight employee share base or.,Week appear owner particular easy food society large establish left cover research.,2024-09-08,2024-08-14 16:19:25+00:00,2025-08-19 17:40:36+00:00
49,7,Because_113647,Role_127556,dawn81@example.com,Natural life investment quality society after per former determine life amount night.,Her leader box animal television value reach former feeling.,2024-11-26,2024-05-08 13:37:19+00:00,2025-07-31 17:25:02+00:00
50,6,Develop_79ee4f,Others_28aaa5,ericblackburn@example.org,Stuff reach animal religious form Democrat act mention avoid surface.,Work by condition along right finally.,2024-09-04,2024-07-22 23:42:47+00:00,2024-07-14 11:39:22+00:00
51,4,Wonder_37c849,Product_7c91aa,tylerhumphrey@example.org,Sure color audience task person travel bit usually town eight experience.,Employee local wife amount project be.,2026-11-12,2025-12-15 03:46:35+00:00,2024-08-24 05:21:41+00:00
52,6,Must_f13b90,Their_90a7a6,bakerrobert@example.com,Color create baby drive simple language difficult hundred south room although fire least.,Product thing because thousand growth main also election student television now.,2026-03-03,2025-02-04 00:43:55+00:00,2026-06-06 22:59:31+00:00
53,4,Ask_47ba9e,Worry_620ed0,coxrobert@example.com,Federal experience before even help record front ahead including through heavy.,Use west continue scene save weight realize writer number more leader.,2025-12-19,2024-08-15 13:05:30+00:00,2025-10-22 17:32:13+00:00
54,9,Large_59875b,Probably_c8181f,ashley91@example.org,So family early clearly hair model have during power five.,Poor direction sign join yet election.,2025-06-11,2025-04-25 06:45:58+00:00,2024-10-22 06:09:17+00:00
55,5,Outside_b7fe3a,Town_3ed5dd,wesleyrodriguez@example.net,People help his prepare oil significant top at development stop.,Structure she other tend picture hope start institution south local see might.,2026-03-14,2025-03-07 20:21:04+00:00,2024-10-02 06:45:50+00:00
56,11,Garden_4a08cd,Fact_b183d9,jbowman@example.com,Magazine article organization consumer sign sell.,Record mean set peace machine night wall network cultural.,2024-09-27,2025-12-11 20:53:34+00:00,2025-03-11 11:23:45+00:00
57,12,Adult_4e4fc8,Theory_d7bfbe,victoriawilliams@example.net,Suggest official difficult ready lose power from market follow moment term their.,Unit ask bed stop realize attorney.,2025-12-29,2024-01-23 14:10:21+00:00,2025-12-26 14:13:21+00:00
58,11,Yes_01eb6b,Full_08d35c,austinrichard@example.net,By would detail return recognize see three wish common find light maintain.,Smile listen size clear describe again rule.,2024-03-04,2025-04-22 13:26:59+00:00,2026-03-11 17:11:44+00:00
59,1,Indeed_1c4735,Conference_660390,ileon@example.com,Whether decision sign he free compare as still town.,Five law process town Congress between final past easy contain yeah sometimes or.,2024-04-02,2025-10-21 12:26:36+00:00,2025-06-15 23:57:09+00:00
60,11,Event_11e734,When_6892ef,ramirezkathleen@example.net,Type than price scene as catch your court pressure back building alone.,Great control much debate position leg evening character alone feeling material become.,2025-05-02,2025-12-07 05:08:32+00:00,2026-04-25 13:31:35+00:00
61,4,Sing_2f9aee,Policy_60497f,diazkaren@example.org,Lot by protect five book indicate through under my interest knowledge.,Western tough report in table difficult help mention morning tonight continue focus near.,2025-08-04,2025-03-07 08:51:21+00:00,2025-07-08 15:02:23+00:00
62,1,Hand_9b49ab,Kind_a2c27f,selena19@example.org,Program we point physical yet paper same.,Large attorney option cultural who finish several sit firm field deal table.,2026-06-25,2025-07-14 01:32:10+00:00,2025-09-19 07:20:14+00:00
63,8,Peace_710ec5,Minute_d128e2,donnamendoza@example.com,Summer nor campaign draw tough last visit product.,Art wind respond strategy policy recently.,2024-03-06,2024-07-10 19:40:45+00:00,2025-06-12 17:00:12+00:00
64,9,At_791042,Policy_7f0d23,sandra84@example.net,Resource behind answer seat possible like even huge above from among.,War give yourself sea sit player later owner.,2024-03-09,2025-05-20 09:46:33+00:00,2024-09-17 06:37:48+00:00
65,8,West_2d54a3,Structure_d4ba68,hunterchristina@example.com,Very instead again feel learn born perform Mr point.,Current important management thousand that finally rock continue audience.,2024-11-17,2025-11-05 00:53:24+00:00,2025-02-16 14:00:55+00:00
66,6,Your_372355,Move_c514b6,ryan05@example.net,Individual girl reason PM become window good the.,Cause resource include sort raise agency yourself wind visit former.,2024-12-10,2025-06-30 08:49:00+00:00,2024-08-13 21:59:52+00:00
67,12,Leader_38b8b2,Each_83b97f,timothykramer@example.org,Employee but step enough section give.,Pressure number exist soldier various fine arm quickly debate.,2025-12-22,2025-02-06 20:49:09+00:00,2025-01-27 12:14:25+00:00
68,11,Care_9115d0,Feeling_2b540c,gomezmegan@example.net,Cell watch modern meeting information go ago big.,Address chair be responsibility voice new when pick life.,2026-07-07,2025-07-22 13:15:32+00:00,2025-11-11 08:14:03+00:00
69,2,Moment_29ad8d,Attorney_bc5e11,david16@example.net,Laugh seven bill thousand manage offer work crime dog total agreement their.,Talk mission choice prepare national tough turn.,2024-09-22,2024-03-12 03:58:57+00:00,2025-07-05 05:29:20+00:00
70,7,Whatever_439b75,Statement_010d73,browntracey@example.org,Pick method probably security although yourself station type knowledge.,End nearly source size young official court grow able never accept listen.,2025-12-07,2024-03-12 23:17:00+00:00,2024-10-18 16:23:09+00:00
71,3,Month_1b5386,Magazine_65a372,stephensjoy@example.com,Share choice husband culture tax couple staff age show certainly accept enough.,Pattern home your run year yourself beat.,2026-11-21,2024-10-28 10:40:46+00:00,2025-12-05 10:26:40+00:00
72,1,Process_6d77ea,Throughout_55801e,laurapalmer@example.com,Money include hotel mouth small blue responsibility official middle.,Who art buy like agency physical listen son.,2025-08-20,2025-05-01 04:42:57+00:00,2024-06-19 08:34:10+00:00
73,5,Body_1d9d80,Green_4777ec,rcrawford@example.net,Morning low involve charge light chance loss head money main.,Style alone character natural price even dog heart spring matter must third.,2025-10-28,2025-02-14 05:23:08+00:00,2025-05-01 12:04:39+00:00
74,2,Would_9b9f44,Pressure_86f02e,ohoffman@example.com,College treatment east mean garden western skill store partner force can our near.,Light energy center mission approach cultural article receive surface source animal agreement hundred.,2024-08-13,2024-12-27 03:16:13+00:00,2025-02-03 19:24:08+00:00
75,6,Prove_474cde,Get_6f3182,kylierobles@example.net,Suggest here concern federal take defense others prepare air.,Where little similar far statement why need ever just laugh such recent game.,2026-07-21,2024-11-23 22:58:18+00:00,2025-05-30 05:02:24+00:00
76,7,Hard_d62947,Live_15839c,joel63@example.org,Mother class house pattern small nothing.,Might must within huge cell both my whole every best by attention.,2026-01-14,2024-09-01 03:02:09+00:00,2026-01-09 20:17:37+00:00
77,10,Analysis_654f6c,President_5eb4d0,dhernandez@example.net,Bed it range become seek so charge manage move four respond decade fund.,Mr wish go not former trouble civil term country every baby show once.,2025-05-15,2025-04-30 19:48:07+00:00,2025-07-29 17:05:04+00:00
78,1,Nothing_a60442,Purpose_414bb6,daniel14@example.com,Pull feeling strategy employee painting test performance everyone gun small on.,Father heart purpose approach Republican attack painting send peace like hour.,2025-12-31,2025-12-26 13:27:13+00:00,2025-03-17 12:41:09+00:00
79,6,Dinner_bbb1f8,Offer_1e60a0,tarmstrong@example.net,Professional myself institution sea difference rock identify performance prepare value physical.,Wonder turn senior drop likely discussion establish research product against sea respond.,2026-05-23,2025-07-11 15:59:31+00:00,2024-12-07 14:40:18+00:00
80,6,Oil_e7a237,Car_060a1a,cjohnson@example.net,Believe adult require less standard success.,Case sense particular ever stage evidence beautiful fish.,2024-03-02,2025-04-24 04:02:44+00:00,2026-01-09 10:06:03+00:00
81,12,Join_30a420,Design_1faa4e,ninafleming@example.com,His where work body kitchen book forget.,Send yet citizen set beyond into teacher interview value professor space better else.,2025-11-27,2025-03-25 15:37:14+00:00,2025-01-23 16:05:00+00:00
82,5,The_08f470,War_a1f4eb,gnolan@example.com,Always film thousand bad tax imagine suddenly word theory.,With institution care cause bed job board hour affect lawyer car nice.,2026-10-09,2025-10-28 05:31:18+00:00,2025-05-17 03:30:32+00:00
83,8,Class_84be73,Need_f937b4,isaiah33@example.com,Mind main million again their social pretty political seat wonder executive remain get.,Mission card single late they anything consider last food pattern wall senior clear.,2026-09-24,2024-10-12 16:07:45+00:00,2024-09-23 07:59:11+00:00
84,3,Be_f3c4b0,Sound_ef8979,hugheschristopher@example.org,Safe candidate cost front improve any finally son actually mean.,Else experience form wide always key finally off letter enough.,2024-02-03,2025-08-17 01:09:38+00:00,2024-06-12 15:39:12+00:00
85,9,Security_44803c,Account_720c1f,anthonyhill@example.org,Protect bit base certain plan inside.,Know future relationship interview song onto particularly bad sing.,2025-01-06,2025-12-03 19:17:17+00:00,2024-05-21 00:12:23+00:00
86,9,Key_86a486,Significant_b7da77,bcollins@example.net,Place bag home issue water deep week chair everybody majority sense fact brother.,Begin movie current when effect act plant man machine serve.,2026-11-05,2025-09-23 12:57:24+00:00,2024-05-04 05:34:31+00:00
87,8,Government_d74394,Name_4bab15,christophersmith@example.org,Explain those write into eye how.,Second fine indicate west all fight religious population score term network stay.,2024-05-15,2024-05-09 12:00:48+00:00,2024-11-18 12:34:28+00:00
88,12,Rock_18903a,Add_e23faa,elizabethbryant@example.org,Sister region writer really require our word ten get.,Push wrong show seem child theory offer carry.,2026-02-08,2025-08-29 03:00:04+00:00,2025-12-03 03:56:11+00:00
89,5,Guess_250373,News_b1e78d,ejones@example.net,Blue total myself design option best avoid evening yeah capital point.,Experience guy mention for crime pattern indeed product control standard physical.,2024-09-08,2025-02-08 23:29:03+00:00,2025-07-31 02:26:49+00:00
90,11,Decision_3db551,Cold_d6e434,suarezderrick@example.org,And bring appear them pick capital community occur.,Vote industry the small civil floor bag myself.,2025-06-13,2025-05-12 01:24:54+00:00,2024-02-02 09:48:32+00:00
91,7,Unit_ee641a,Quite_7db380,gomezsusan@example.com,Special oil technology quickly thousand window ok store.,Back billion probably with teach painting allow nothing away election explain.,2025-01-28,2024-12-26 17:29:31+00:00,2025-02-22 12:03:39+00:00
92,9,Within_4d11d2,Young_8355d6,michael16@example.net,Never own loss decide remember commercial.,Until production phone senior off or then marriage culture kitchen.,2025-10-09,2024-07-21 03:21:53+00:00,2025-04-09 19:19:31+00:00
93,12,Past_10ad85,Say_deb4a2,tmercado@example.net,Interview him save nothing drive book study.,Current page some inside buy perform what.,2026-05-09,2024-08-28 10:17:37+00:00,2025-03-24 11:19:30+00:00
94,5,Service_cb7b87,Summer_1e683c,ihughes@example.com,Region none Democrat car western radio policy participant return find.,In start travel decade building scene.,2024-11-27,2024-06-05 19:20:04+00:00,2024-06-14 17:22:23+00:00
95,10,Camera_c4f68a,Rich_236f3a,phillipsellers@example.net,Occur force fear office radio little main travel region end service best.,Green if again key organization staff check five.,2026-01-15,2025-07-26 12:59:57+00:00,2025-06-09 09:26:28+00:00
96,7,Boy_8d8a09,Consumer_5a4af2,robertsmichael@example.org,Yes read cultural recognize teacher opportunity analysis family.,Build lead although forward example computer ten point.,2026-02-28,2024-07-28 13:52:55+00:00,2024-07-14 07:16:43+00:00
97,6,But_bc9e41,Trouble_e58c8f,tonyrogers@example.com,Education staff blood history receive late.,Per both political car idea century writer.,2025-08-16,2024-05-19 08:21:05+00:00,2024-03-19 05:33:46+00:00
98,12,Fish_a0c168,Remain_267435,leemichael@example.com,Great key million actually movie against future plant both fight mother nice outside.,That able enter weight down well news city.,2026-02-12,2024-09-16 09:03:27+00:00,2025-01-01 18:22:45+00:00
99,6,Matter_7022ad,Speak_e9a94b,brianhernandez@example.org,Power official letter want season report much recent reach particularly course believe science.,Real one south concern subject whatever.,2025-06-22,2025-08-07 23:25:53+00:00,2026-03-08 08:14:08+00:00
100,3,Must_b51106,State_16552a,hughesmolly@example.org,Cold experience conference important girl during.,Six per contain value pick call pretty up.,2026-03-31,2024-07-17 09:39:36+00:00,2025-07-06 08:20:47+00:00
101,7,Professor_2e8c31,Contain_a21933,tspencer@example.com,Station top water either according purpose there force.,They energy face city mind character state carry leader popular authority.,2025-01-14,2024-04-03 23:31:46+00:00,2025-03-10 10:03:21+00:00
102,3,Trial_fb7db2,Stand_8698d4,kevin99@example.com,Fight sound data fund country bed culture occur.,Alone quality bad general site recent a check go.,2026-03-19,2024-12-08 07:04:21+00:00,2024-04-22 18:57:59+00:00
103,3,Bad_ca6da5,Friend_78e406,masonebony@example.org,Toward degree clear college doctor role movie.,Again single history morning when she any local.,2026-09-02,2024-02-26 14:11:13+00:00,2026-02-08 06:22:40+00:00
104,2,Remain_be502f,Practice_074284,andrewsaaron@example.net,End gas consumer firm evening him.,Fact report knowledge candidate sound century near west.,2025-06-17,2024-06-26 09:33:40+00:00,2025-10-26 15:09:34+00:00
105,9,One_6e0f5c,Radio_b013d0,jose16@example.net,Difficult visit material notice others series use must inside where term fear.,Tax fill green whose upon firm federal agreement high sing decision successful.,2026-01-20,2024-02-11 19:34:47+00:00,2025-12-23 01:00:55+00:00
106,4,Individual_6ba371,Case_320836,carljacobs@example.com,Doctor whether apply give quality course.,Add animal able investment hand form call rate moment space.,2025-11-06,2025-09-22 01:04:23+00:00,2024-06-18 19:54:48+00:00
