hotel_id,name,brand,address_id,timezone,created_at,updated_at
1,Particular_f0a616,White less lot unit face nearly college administration drop.,712,America/New_York,2025-06-09 19:35:47+00:00,2024-07-06 21:17:23+00:00
2,Citizen_dfa146,Father capital build place individual head then sort perform account nor same point.,970,America/New_York,2025-01-31 03:09:57+00:00,2025-11-01 09:06:33+00:00
3,Soldier_307aa2,Others difficult smile suffer continue cultural store cost city.,548,America/New_York,2024-07-03 08:12:24+00:00,2025-09-25 21:46:06+00:00
4,Memory_1b7b63,Business one current source most scene Mr allow truth.,130,America/New_York,2025-12-19 22:30:56+00:00,2024-03-17 08:19:58+00:00
5,This_3303d1,Age thus than forward raise need fall hard court since.,1288,America/New_York,2025-05-28 21:11:28+00:00,2024-09-24 01:34:40+00:00
6,Two_41ca7f,Fire fight every short final similar prevent population family bar push.,1563,America/New_York,2025-11-22 12:40:40+00:00,2024-08-26 10:40:11+00:00
7,Him_4bfc75,Detail hundred number heart hold woman.,1940,America/New_York,2025-06-14 10:36:33+00:00,2026-04-26 13:05:42+00:00
8,Notice_9f3aad,Race manager question trial character statement American consider population several up can traditional.,989,America/New_York,2024-04-24 17:15:05+00:00,2025-02-22 14:38:51+00:00
9,Kitchen_d1b9f8,Themselves left detail not who role speak despite young table determine.,23,America/New_York,2024-04-16 08:24:21+00:00,2025-01-29 17:11:27+00:00
10,Church_bd42e9,High fact rock individual statement night act pretty environmental majority on.,1671,America/New_York,2025-11-09 08:30:32+00:00,2024-06-19 08:23:21+00:00
11,Life_975a0b,Nation much town writer whose investment green.,1654,America/New_York,2025-11-05 22:00:51+00:00,2024-08-11 19:27:40+00:00
12,Tend_906ca7,All yeah land success production call model commercial president simple party north serve.,757,America/New_York,2024-07-07 16:05:58+00:00,2025-03-05 18:54:04+00:00
